"109","998","","","","","471633797","2012-01-23T02:55:16.000Z","rather be hated for who I am, then loved for who I am not..MM ..i love me","","Lets burn the whole Middle East enough already...wtf happened to peace an love for fcks sack#BostonMarathon","","","","en","","","","","","","","false","0","false","","","false","","59","","","","","","","","","","","","false","","","","false","","","false","324224287806472192","lolo bubbles","","<a href=""http://twitter.com/#!/download/ipad"" rel=""nofollow"">Twitter for iPad</a>","","","","","","en","","","false","","","338","","false","false","","","","","0","","","","","nyc/jersey","0","","","","","-1","lolobubbles","","","","2013-04-16T18:14:28.000Z","","",""
"177","126","RTL info","<a href=""http://www.rtlinfo.be/"" rel=""nofollow"">RTL info pour Tweeter</a>","false","324186699766837249","85282814","2009-10-26T10:16:24.000Z","Gamer et amateur automobile, j'aime également pas mal d'autres choses telles que l'humour, l'informatique (OpenSource notamment) et la lecture...","","Explosions à Boston: la famille de Bill le marathonien décimée http://t.co/IONYRKVwXo","","","fr","fr","false","[6770022]","","237722","http://t.co/gZH4l5UtsN","true","false","false","2","false","","1040","false","[http://l.rtl.be/15d0Tti]","2386","Brussels","","","0","-1","","","rtlinfo","","","2013-04-16T15:45:06.000Z","false","","","","false","85819","1048","false","324188384526471172","Dempiller","6770022","<a href=""http://hotot.org"" rel=""nofollow"">Hotot</a>","2007-06-12T15:53:12.000Z","","Retrouvez toute l'actualité en Belgique, en Europe ou dans le monde, les dernières informations politiques, sportives ou économiques.","","Explosions à Boston: la famille de Bill le marathonien décimée http://t.co/IONYRKVwXo","fr","","RT @rtlinfo: Explosions à Boston: la famille de Bill le marathonien décimée http://t.co/IONYRKVwXo","false","fr","","50580","http://t.co/8XiQ9WpU6V","false","false","2","false","false","","7","[http://l.rtl.be/15d0Tti]","false","","140","","0","","","","","-1","Dempiller","","true","","2013-04-16T15:51:48.000Z","","[rtlinfo]","false"
"3934","2058","","","","","44465607","2009-06-03T21:43:02.000Z","Boston-based TV show created in 1968. Reflects on the concerns and culture of communities of color. Hosted by @CallieCrossley, Fridays @ 7:30 PM on WGBH2.","","Obama to travel to Boston on Thursday, attend interfaith service for marathon bombing victims http://t.co/UKySmyqp97 via @washingtonpost","","","","en","","[2467791]","","","","","","false","1","false","","","false","","835","","","","","","","","","","","","false","","","","false","","","false","324275282137718785","Basic Black","","<a href=""https://dev.twitter.com/docs/tfw"" rel=""nofollow"">Twitter for Websites</a>","","","","","","en","","","false","","","11863","http://t.co/GqrJPXc4qU","true","false","","","","","179","[http://wapo.st/12kjSza]","","","","Boston, MA","0","","","","","-1","BasicBlackWGBH","","","","2013-04-16T21:37:06.000Z","","[washingtonpost]",""
"290","223","Living In Singapore","<a href=""http://twitter.com"" rel=""nofollow"">Twitter Web Client</a>","false","324035284297715712","89597943","2009-11-13T01:48:12.000Z","Arsenal fc.
Every story have an ending.","","So now cos of the Boston bombings 'Muslims' is trending?

Wow, fuck stereotypes, not every bombing is done by a Muslim.","","","en","en","false","[721605884]","","19761","http://t.co/srgZMhAM4J","false","false","false","123","false","","65","false","","3701","Singlishpore","","","20","-1","","","livinginsg","","","2013-04-16T05:43:26.000Z","false","","","","false","20726","654","false","324381242831302656","If you dont want to die, think","721605884","<a href=""http://twitter.com/download/android"" rel=""nofollow"">Twitter for Android</a>","2012-07-28T05:59:01.000Z","","Huh? What bio?","","So now cos of the Boston bombings 'Muslims' is trending?

Wow, fuck stereotypes, not every bombing is done by a Muslim.","en","","RT @livinginsg: So now cos of the Boston bombings 'Muslims' is trending?

Wow, fuck stereotypes, not every bombing is done by a Muslim.","false","en","","64535","","true","false","123","false","false","","5","","false","","163","East Region, Singapore","0","","","","","-1","13farhanshah13","","false","","2013-04-17T04:38:09.000Z","","[livinginsg]","false"
"807","769","","","","","49180067","2009-06-21T01:04:52.000Z","Labels? Constitutionalist/Libertarian/Gonzo-Conservative. Professional SomethingOrOther. Cyclist. Gun-rights loudmouth. Musician. Gamer.","","Halfwit actor @jaymohr37 blames #Boston attack on gun culture: ’2nd amendment must go’ http://t.co/cm4tlTHKt6","","","","en","","[52757166]","","","","","","false","0","false","","","false","","395","","","","","","","","","","","","false","","","","false","","","false","324562235429122048","Ellis","","<a href=""https://dev.twitter.com/docs/tfw"" rel=""nofollow"">Twitter for Websites</a>","","","","","","en","","","false","","","4810","","true","false","","","","","36","[http://dailycaller.com/2013/04/16/actor-blames-boston-attack-on-gun-culture-2nd-amendment-must-go/]","","","","At the bottom of Lake Michigan","0","","","","[Boston]","-1","Ellis4TW","","","","2013-04-17T16:37:21.000Z","","[jaymohr37]",""
"1017","184","","","","","336759570","2011-07-16T21:23:51.000Z","لست كاملاً ،، لكن ،،، It's wonderful to be me الكويت_Kuwait","","We feel sorrow and anger for what happened in Boston, but people killed in dozens in Syria  daily 
#bostonmarathon 
#Sryia
#BostonExplosion","","","","en","","","","","","","","false","0","false","","","false","","662","","","","","","","","","","","","false","","","","false","","","false","324190376829284352","ابو محمد المطيري","","<a href=""http://twitter.com/download/iphone"" rel=""nofollow"">Twitter for iPhone</a>","","","","","","ar","","","false","","","15259","","false","false","","","","","1","","","","","","0","","","","[bostonmarathon, Sryia, BostonExplosion]","-1","abo_muhmmad","","","","2013-04-16T15:59:43.000Z","","",""
"154","86","","","","","159199492","2010-06-24T18:50:48.000Z","i barely post shit","","On the brightside I heard the Boston marathon was a blast.","","","","en","","","","","","","","false","1","false","","","false","","2148","","","","","","","","","","","","false","","","","false","","","false","324351358427877376","amir.","","<a href=""http://twitter.com/download/android"" rel=""nofollow"">Twitter for Android</a>","","","","","","en","","","false","","","3745","","true","false","","","","","1","","","","","San Marcos, CA","1","","","","","-1","rimamaii","","","","2013-04-17T02:39:24.000Z","","",""
"11361","16957","Bill Neely","<a href=""http://twitter.com/download/iphone"" rel=""nofollow"">Twitter for iPhone</a>","false","323887915891568640","41656708","2009-05-21T19:25:44.000Z","I am a Psychic, Writer, Poet, & I follow a Spiritual path!  I'm currently looking for a publisher for a new poem book!  Poem book:  Universal Rhythms: Xlibris..","","Remember bomb at Atlanta Olympics 1996- home grown terrorists. Be cautious about pinning #Boston explosion on Al Qaeda or Islamists.","","","en","en","false","[2228608580]","","11864","http://t.co/8xx8pxDeCQ","true","false","false","313","false","","965","false","","6251","London","","","48","-1","","","BillNeelyNBC","[Boston]","","2013-04-15T19:57:51.000Z","false","","","","false","32708","730","false","324286933901668352","Wanda Diane Bruckner","87165980","<a href=""http://twitter.com"" rel=""nofollow"">Twitter Web Client</a>","2009-11-03T10:58:13.000Z","","Chief Global Correspondent @NBCNews. Husband, father, marathon runner, amateur Triathlete, wine lover & Leeds United optimist against all the evidence","","Remember bomb at Atlanta Olympics 1996- home grown terrorists. Be cautious about pinning #Boston explosion on Al Qaeda or Islamists.","en","","RT @billneelyitv: Remember bomb at Atlanta Olympics 1996- home grown terrorists. Be cautious about pinning #Boston explosion on Al Qaeda ...","false","en","","15705","http://t.co/kF7zstJq","false","false","313","false","false","","45","","false","","182","Hattiesburg, Miss.","0","","","","[Boston]","-1","Thirdeyereopene","","true","","2013-04-16T22:23:24.000Z","","[BillNeelyITV]","false"
"10489","767","","","","","17645505","2008-11-26T08:23:47.000Z","Writes timeline books | Donald Trump: Deplorable Bully | Breathing Hope & Fear | https://t.co/bhGOT1nU86 | Host @ThreeMuckrakers RT≠endorsement.","","RT @jilevin Tea Party Congressman Uses Boston Marathon Bombing To Justify Opposing Immigration Reform http://t.co/UROMNldztS","","","","en","","[24733117]","","","","","","false","1","false","","","false","","11170","","","","","","","","","","","","false","","","","false","","","false","324553469342150656","DenisCampbell","","<a href=""http://www.hootsuite.com"" rel=""nofollow"">Hootsuite</a>","","","","","","en","","","false","","","185292","https://t.co/xZm2qjc5Ai","false","false","","","","","734","[http://bit.ly/10aVh1U]","","","","Cardiff","1","","","","","-1","UKProgressive","","","","2013-04-17T16:02:31.000Z","","[jilevin]",""
"409","287","We Are Bruins Fans!","<a href=""http://twitter.com/download/iphone"" rel=""nofollow"">Twitter for iPhone</a>","false","324134481072099329","415860165","2011-11-18T22:32:46.000Z","Youll never walk alone #cfc","","Thank you Chicago. One of the most classiest things I've seen in a while. 
#PrayForBoston http://t.co/2ZeLK2Sja5","","","en","en","false","[1076862674]","","1816","","false","false","false","593","false","","11","false","","3472","Everywhere","[photo]","","346","-1","","","WeAreBruinsFans","[PrayForBoston]","[http://pbs.twimg.com/media/BH-Ol9xCEAA6eaT.jpg]","2013-04-16T12:17:37.000Z","false","","","","false","1452","47","false","324174069371121665","kevin ramsey","1076862674","<a href=""http://twitter.com/download/iphone"" rel=""nofollow"">Twitter for iPhone</a>","2013-01-10T15:17:55.000Z","","We're loud and obnoxious hockey fans. We're diehard Boston Bruins fans. 
BRING THE CUP HOME!","","Thank you Chicago. One of the most classiest things I've seen in a while. 
#PrayForBoston http://t.co/2ZeLK2Sja5","en","","RT @WeAreBruinsFans: Thank you Chicago. One of the most classiest things I've seen in a while. 
#PrayForBoston http://t.co/2ZeLK2Sja5","false","en","","8007","","false","false","593","false","false","","1","","false","[photo]","344","","0","","","","[PrayForBoston]","-1","kramsey671888","","false","[http://pbs.twimg.com/media/BH-Ol9xCEAA6eaT.jpg]","2013-04-16T14:54:55.000Z","","[WeAreBruinsFans]","false"
"1041","976","BuzzFeed","<a href=""http://www.socialflow.com"" rel=""nofollow"">SocialFlow</a>","false","324151789425410048","165658656","2010-07-12T05:35:47.000Z","Visual Artist | Fotografie en Tekenen | Visueel Notuleren | Bedenker #deelinspiratie and #TekenChallenge | Tips, tutorials en inspiratie: https://t.co/Pmh7PDEWU0","","Boston Marathon tragedy met with unbelievable acts of kindness http://t.co/TD7ivgKCer http://t.co/eU2uhFtq23","","","en","en","false","[5695632]","","193434","https://t.co/UhQYtFIPIq","true","false","false","177","false","","23028","false","[http://bzfd.it/15i1fPv]","1256","New York","[photo]","","65","-1","","","BuzzFeed","","[http://pbs.twimg.com/media/BH-eVceCQAAdnnq.jpg]","2013-04-16T13:26:23.000Z","false","","","","false","6567709","3049","false","324153877991653379","Yvonne de Hont","5695632","<a href=""http://tapbots.com/tweetbot"" rel=""nofollow"">Tweetbot for iOS</a>","2007-05-01T21:40:03.000Z","","@BuzzFeed","","Boston Marathon tragedy met with unbelievable acts of kindness http://t.co/TD7ivgKCer http://t.co/eU2uhFtq23","nl","","RT @BuzzFeed: Boston Marathon tragedy met with unbelievable acts of kindness http://t.co/TD7ivgKCer http://t.co/eU2uhFtq23","false","en","","16602","https://t.co/vRgrwo6oGu","true","false","177","false","false","","55","[http://bzfd.it/15i1fPv]","false","[photo]","3212","Den Bosch, The Netherlands","0","","","","","-1","yvonnedehont","","true","[http://pbs.twimg.com/media/BH-eVceCQAAdnnq.jpg]","2013-04-16T13:34:41.000Z","","[BuzzFeed]","false"
"1096","136","Angela Raiola","<a href=""http://twitter.com/download/iphone"" rel=""nofollow"">Twitter for iPhone</a>","false","323944425879375873","1073870035","2013-01-09T14:00:52.000Z","Live your greatest joy!  YOLO so make it count!  Moving FORWARD means never looking back!  LIVE your DREAMS!!","","Everyone pray for people in Boston. This was a tragic event that no one deserves, I'm praying for all of you http://t.co/b6Ro93qPuP","","","en","en","false","[420533304]","","14371","https://t.co/RIF4s0YErQ","false","false","false","56","false","","720","false","[http://www.youtube.com/watch?v=cGyhp4RqSkk]","162","Instagram: @biggangvh1","","","20","-1","","","biggangVH1","","","2013-04-15T23:42:24.000Z","false","","","","false","334058","2321","false","324183707898478593","Olinka","420533304","<a href=""http://twitter.com"" rel=""nofollow"">Twitter Web Client</a>","2011-11-24T19:15:02.000Z","","The official Twitter account for Angela Big Ang Raiola. Legal:Sspinelli@spinellilaw.com Management:jgraziano@justjennproductions.com","","Everyone pray for people in Boston. This was a tragic event that no one deserves, I'm praying for all of you http://t.co/b6Ro93qPuP","en","","RT @biggangVH1: Everyone pray for people in Boston. This was a tragic event that no one deserves, I'm praying for all of you http://t.co ...","false","en","","61047","","false","false","56","false","false","","138","","false","","3229","","0","","","","","-1","Homervillehound","","true","","2013-04-16T15:33:13.000Z","","[biggangVH1]","false"
"101","146","Centrepoint","<a href=""http://twitter.com"" rel=""nofollow"">Twitter Web Client</a>","false","324104124100648960","105317367","2010-01-16T00:57:58.000Z","Doing what I can with all I have wherever I am. Making the rest of my life the best of my life.","","London Marathon runners are urged to cross the line on Sunday with their #handsoverhearts in tribute to the Boston bombings.","","","en","en","false","[42644368]","","8828","http://t.co/GeywS0JsPa","true","false","false","195","false","","492","false","","221","UK","","","23","-1","","","centrepointuk","[handsoverhearts]","","2013-04-16T10:16:59.000Z","false","","","","false","38594","1136","false","324155304055037954","mara","42644368","<a href=""http://twitter.com"" rel=""nofollow"">Twitter Web Client</a>","2009-05-26T15:16:35.000Z","","Centrepoint is the UK's leading charity for homeless young people.

If you're homeless or at risk and aged 16-25 please call our free Helpline - 0808 800 0661.","","London Marathon runners are urged to cross the line on Sunday with their #handsoverhearts in tribute to the Boston bombings.","en","","RT @centrepointuk: London Marathon runners are urged to cross the line on Sunday with their #handsoverhearts in tribute to the Boston bo ...","false","en","","1401","","true","false","195","false","false","","3","","false","","2221","NYC","0","","","","[handsoverhearts]","-1","MaraJoyT","","true","","2013-04-16T13:40:21.000Z","","[centrepointuk]","false"
"35","169","","","","","1097934078","2013-01-17T11:49:38.000Z","Vi er nettets ledende leverandør av fullt autorisert Arsenal Club Level #billetter til Barclays Premier League og Champions League #AFC #Fotball #ArseNor","","Boston marathon: Arsenal v Everton minute's silence http://t.co/1AsBxR9pUy #arsenor #afc #arsenal","","","","en","","","","","","","","false","0","false","","","false","","0","","","","","","","","","","","","false","","","","false","","","false","324166335091318786","Billetter4Arsenal","","<a href=""http://www.hootsuite.com"" rel=""nofollow"">Hootsuite</a>","","","","","","no","","","false","","","571","http://t.co/MdBxdUr6","false","false","","","","","0","[http://ow.ly/k7213]","","","","Norge","0","","","","[arsenor, afc, arsenal]","-1","Billetter4AFC","","","","2013-04-16T14:24:11.000Z","","",""
"125","843","Danny Amendola","<a href=""http://twitter.com/download/iphone"" rel=""nofollow"">Twitter for iPhone</a>","false","324020933012619264","77558929","2009-09-26T19:49:24.000Z","","","I will DONATE $100 for EVERY pass I catch next season to whatever ""Boston Marathon Relief Fund"" there is. And $200 for any dropped pass.","","","en","en","false","[829673054]","","577","https://t.co/Rc0vCs07qp","true","false","false","29137","false","","1141","false","","161","Miami, FL","","","11198","-1","","","DannyAmendola","","","2013-04-16T04:46:25.000Z","false","","","","false","427033","448","false","324171716383371264","Nicole","829673054","<a href=""http://twitter.com/download/iphone"" rel=""nofollow"">Twitter for iPhone</a>","2012-09-17T19:33:41.000Z","","Miami Dolphins WR | Business Inquiries: @JacquelynKDavis","","I will DONATE $100 for EVERY pass I catch next season to whatever ""Boston Marathon Relief Fund"" there is. And $200 for any dropped pass.","en","","RT @DannyAmendola: I will DONATE $100 for EVERY pass I catch next season to whatever ""Boston Marathon Relief Fund"" there is. And $200 fo ...","false","en","","1135","","false","false","29137","false","false","","2","","false","","15","NY","0","","","","","-1","nicole8191","","true","","2013-04-16T14:45:34.000Z","","[DannyAmendola]","false"
"454","181","","","","","121840615","2010-03-10T19:26:10.000Z","Founded in 1979, the Maine Track Club is Maine's largest and most active running club.

Tweets are managed by Chandra - @socialclem","","The running community turned out tonight in support of those affected by the tragedy at the Boston Marathon. Proud... http://t.co/yF5cEVzj5E","","","","en","","","","","","","","false","0","false","","","false","","30","","","","","","","","","","","","false","","","","false","","","false","324337903079657472","Maine Track Club","","<a href=""http://www.facebook.com/twitter"" rel=""nofollow"">Facebook</a>","","","","","","en","","","false","","","2165","http://t.co/vD3UGbREdy","false","false","","","","","10","[http://fb.me/tMoSSKyK]","","","","Maine","0","","","","","-1","MaineTrackClub","","","","2013-04-17T01:45:56.000Z","","",""
"4147","2801","Ally Brooke","<a href=""http://twitter.com/download/iphone"" rel=""nofollow"">Twitter for iPhone</a>","false","323917636201226242","528674324","2012-03-18T17:07:20.000Z","ahora soy fome","","#prayforboston I am so so sorry for this tragedy.... :(","","","en","en","false","[27776098]","","17505","https://t.co/XhtCvgwa5Y","false","false","false","812","false","","7419","false","","7157","Instagram: Allybrooke","","","558","-1","","","AllyBrooke","[prayforboston]","","2013-04-15T21:55:57.000Z","false","","","","false","2738015","7896","false","324323713778585602","icarly","27776098","<a href=""http://twitter.com"" rel=""nofollow"">Twitter Web Client</a>","2009-03-31T01:00:36.000Z","","","","#prayforboston I am so so sorry for this tragedy.... :(","es","","RT @AllyBrooke: #prayforboston I am so so sorry for this tragedy.... :(","false","en","","68694","https://t.co/tzGJdjZVu8","true","false","812","false","false","","23","","false","","5988","chile","0","","","","[prayforboston]","-1","fifthwhoharmony","","true","","2013-04-17T00:49:33.000Z","","[AllyBrooke]","false"
"219","454","Kerryn Gerety","<a href=""http://twitter.com"" rel=""nofollow"">Twitter Web Client</a>","false","324270083797024771","245574381","2011-02-01T00:35:58.000Z","Disaster Responder; die-hard baseball fan (NYY!); sugar addict; traditional country music junkie; fluent in sarcasm; proud blue blood. Never Forget.","","In just 20 hours BOS tech community has raised over $70K for #BostonMarathon victims. Let's hit $100K! http://t.co/eBWjX51Fxw #OneBoston","","","en","en","false","[116501806]","","639","https://t.co/ypQKvFdFPm","false","false","false","56","false","","57","false","[http://www.fundraise.com/boston]","699","Boston","","","17","-1","","","kerryngerety","[BostonMarathon, OneBoston]","","2013-04-16T21:16:27.000Z","false","","","","false","1671","451","false","324271867965870080","Kristen","116501806","<a href=""http://twitter.com"" rel=""nofollow"">Twitter Web Client</a>","2010-02-22T17:51:47.000Z","","Tech #Entrepreneur. Tomboy. Eternal Optimist. Known to Quote Classic Literature & Classic Hip Hop. Focused on Innovating in #SustainableAgriculture.","","In just 20 hours BOS tech community has raised over $70K for #BostonMarathon victims. Let's hit $100K! http://t.co/eBWjX51Fxw #OneBoston","en","","RT @kerryngerety: In just 20 hours BOS tech community has raised over $70K for #BostonMarathon victims. Let's hit $100K! http://t.co/eBW ...","false","en","","1179","https://t.co/LYMKtCUWd5","true","false","56","false","false","","9","","false","","61005","American by the Grace of God ","0","","","","[BostonMarathon]","-1","K_WhitleyFan","","false","","2013-04-16T21:23:32.000Z","","[kerryngerety]","false"
"1073","743","","","","","579516471","2012-05-14T01:23:19.000Z","","","- #PrayForBoston 😔👼🙏","","","","und","","","","","","","","false","0","false","","","false","","4814","","","","","","","","","","","","false","","","","false","","","false","324249482957033472","JuuJuu 🇩🇴","","<a href=""http://twitter.com/download/iphone"" rel=""nofollow"">Twitter for iPhone</a>","","","","","","en","","","false","","","31692","","true","false","","","","","3","","","","","","0","","","","[PrayForBoston]","-1","Ayo_Juliee","","","","2013-04-16T19:54:35.000Z","","",""
"270","473","Dan Patrick Show","<a href=""https://dev.twitter.com/docs/tfw"" rel=""nofollow"">Twitter for Websites</a>","false","324168341604413440","16248697","2008-09-11T22:16:42.000Z","A fan of Mississippi State, the Yankees, Grizzlies, and Raiders(I hate you for this Bo Jackson).","","Dan's Opening Monologue on Boston Tragedy http://t.co/EeaGt06ULa","","","en","en","false","[65414320]","","16887","https://t.co/oIAOY540kZ","false","false","false","29","false","","4474","false","[http://youtu.be/T_FguNn6CQU]","105","Milford, CT","","","35","-1","","","dpshow","","","2013-04-16T14:32:10.000Z","false","","","","false","413376","1248","false","324175336059314176","Dawgbot","65414320","<a href=""http://twitter.com/download/iphone"" rel=""nofollow"">Twitter for iPhone</a>","2009-08-13T17:19:41.000Z","","The OFFICIAL Dan Patrick Show twitter @PaulPabst @HiMyNameIsSeton @andrewperloff @brooklynfritzy

IG: danpatrickshow","","Dan's Opening Monologue on Boston Tragedy http://t.co/EeaGt06ULa","en","","RT @dpshow: Dan's Opening Monologue on Boston Tragedy http://t.co/EeaGt06ULa","false","en","","15684","","false","false","29","false","false","","7","[http://youtu.be/T_FguNn6CQU]","false","","2714","","0","","","","","-1","Dawgbot","","true","","2013-04-16T14:59:57.000Z","","[dpshow]","false"
"494","392","fe","<a href=""http://twitter.com"" rel=""nofollow"">Twitter Web Client</a>","false","324287151753797632","380605697","2011-09-26T22:54:17.000Z","","","#prayforboston http://t.co/h43pa361QK","","","pt","und","false","[946815493897441283]","","65710","","true","false","false","1","false","","3","false","","689","","[photo]","","0","-1","","","behalright","[prayforboston]","[http://pbs.twimg.com/media/BIAZckXCIAARGBa.jpg]","2013-04-16T22:24:16.000Z","false","","","","false","1550","868","false","324287344960208896",".","526987135","<a href=""http://twitter.com"" rel=""nofollow"">Twitter Web Client</a>","2012-03-17T01:46:57.000Z","","go with what you believe and seek his purpose","","#prayforboston http://t.co/h43pa361QK","pt","","RT @carryonswag: #prayforboston http://t.co/h43pa361QK","false","und","","37710","","false","false","1","false","false","","1","","false","[photo]","15853","","0","","","","[prayforboston]","-1","lavignouz","","false","[http://pbs.twimg.com/media/BIAZckXCIAARGBa.jpg]","2013-04-16T22:25:02.000Z","","[CarryOnSwag]","false"
"211","414","","","","","151287149","2010-06-03T02:05:08.000Z","And therefore, yes, thank you.","","No more stories of Boston for Jwil, too many nightmares #prayforboston","","","","en","","","","","","","","false","0","false","","","false","","2814","","","","","","","","","","","","false","","","","false","","","false","324500323324530688","Jwil","","<a href=""http://twitter.com/download/android"" rel=""nofollow"">Twitter for Android</a>","","","","","","en","","","false","","","11276","","true","false","","","","","8","","","","","St. Louis","0","","","","[prayforboston]","-1","Jwil18","","","","2013-04-17T12:31:20.000Z","","",""
"139","64","","","","","707570238","2012-07-20T18:16:50.000Z","some call me a pharmacist but really I just skateboard #sixseasonsandamovie","","#PrayforBoston http://t.co/AhMAyXgf2Q","","","","und","","","","","","","","false","0","false","","","false","","1598","","[photo]","","","","","","","","","","false","","","","false","","","false","324226208780918784","Ty","","<a href=""http://blackberry.com/twitter"" rel=""nofollow"">Twitter for BlackBerry®</a>","","","","","","en","","","false","","","5780","https://t.co/bvYVf28qUE","false","false","","","","","0","","","","","","2","","","","[PrayforBoston]","-1","Ty_Canning1","","","[http://pbs.twimg.com/media/BH_iBOGCIAEvibK.jpg]","2013-04-16T18:22:06.000Z","","",""
"112","24","","","","","1356310867","2013-04-16T07:40:08.000Z","Japanese artist. 主導権は常にユーモアに忠実","","pray for boston

#prayforboston  http://t.co/C0Wsz5DBJH","","","","en","","","","","","","","false","0","false","","","false","","11","","","","","","","","","","","","false","","","","false","","","false","324411114656002048","Art is Joke","","<a href=""http://itunes.apple.com/us/app/twitter/id409789998?mt=12"" rel=""nofollow"">Twitter for Mac</a>","","","","","","ja","","","false","","","416","http://t.co/UPjN7WOnwW","false","false","","","","","1","[http://yfrog.com/odh6xytnj]","","","","","0","","","","[prayforboston]","-1","ArtisJoke","","","","2013-04-17T06:36:51.000Z","","",""
