"453","494","Fergie","<a href=""http://twitter.com"" rel=""nofollow"">Twitter Web Client</a>","false","295983434680107008","215489327","2010-11-14T02:37:33.000Z","“Louco é quem não procura ser feliz.”
~ Mário Quintana.","","Envio minhas orações para as vítimas do incêndio no clube em #SantaMaria. O meu coração está com vocês #Brasil. ❤ #PrayForSantaMaria","","","en","pt","false","[245992215]","","3803","https://t.co/9yKbmksbnR","true","false","false","3118","false","","4755","false","","233","Los Angeles, CA","","","879","-1","","","Fergie","[SantaMaria, Brasil, PrayForSantaMaria]","","2013-01-28T19:55:24.000Z","false","","","","false","4198534","629","false","296017983451582465","Isabelle ㅤ‹з","245992215","<a href=""http://twitter.com"" rel=""nofollow"">Twitter Web Client</a>","2011-02-01T22:15:24.000Z","","DOUBLE DUTCHESS: Seeing Double — The Visual Experience: https://t.co/yYH5zOT4jN","","Envio minhas orações para as vítimas do incêndio no clube em #SantaMaria. O meu coração está com vocês #Brasil. ❤ #PrayForSantaMaria","pt","","RT @Fergie: Envio minhas orações para as vítimas do incêndio no clube em #SantaMaria. O meu coração está com vocês #Brasil. ❤ #PrayForSa ...","false","pt","","7609","","true","false","3118","false","false","","1","","false","","5608","Ribeirão Preto -SP","0","","","","[SantaMaria, Brasil]","-1","isabelle_gomess","","true","","2013-01-28T22:12:41.000Z","","[Fergie]","false"
"44908","308","","","","","169979388","2010-07-23T17:07:28.000Z","não","","Olhem os ultimos tweets da menina que morreu na boate kiss. https://t.co/QoJdxOeB . Nossaaa.. ='(","","","","pt","","","","","","","","false","2","false","","","false","","1263","","","","","","","","","","","","false","","","","false","","","false","296047880450473984","ploc","","<a href=""https://mobile.twitter.com"" rel=""nofollow"">Mobile Web (M2)</a>","","","","","","pt","","","false","","","239992","","true","false","","","","","1205","[https://mobile.twitter.com/Andriirs]","","","","","0","","","","","-1","corujinhascl","","","","2013-01-29T00:11:29.000Z","","",""
"651","2046","Tom","<a href=""http://twitter.com"" rel=""nofollow"">Twitter Web Client</a>","false","296061190344429568","43393714","2009-05-29T19:41:36.000Z","Observador,Divertido,Cinéfilo porHobbie,Ativista... Ah si fudê!!! Quem se define se limita...
Sou CORITIBA de coração!!!","","A Boate Kiss  vira mistério  começou a sumir  as provas  do crime","","","pt","pt","false","[150018263]","","370133","","false","false","false","3","false","","225","false","","682","Condado City","","","0","-1","","","Tom_brz","","","2013-01-29T01:04:22.000Z","false","","","","false","5476","938","false","296061298045775872","Thiago Rocha","150018263","<a href=""http://twitter.com/download/iphone"" rel=""nofollow"">Twitter for iPhone</a>","2010-05-30T21:19:55.000Z","","na varanda da direita","","A Boate Kiss  vira mistério  começou a sumir  as provas  do crime","en","","RT @Tom_brz: A Boate Kiss  vira mistério  começou a sumir  as provas  do crime","false","pt","","18618","","false","false","3","false","false","","7","","false","","4025","São Paulo, Brasil","0","","","","","-1","thiagorocha78","","false","","2013-01-29T01:04:48.000Z","","[Tom_brz]","false"
"160","341","","","","","205239701","2010-10-20T12:40:48.000Z","Marido, Pai, Pr. Quadrangular, Prof. Universitário. Encontrado, resgatado e salvo por Cristo","","Igrejas e voluntários levam assistência às famílias e vítimas do incêndio na boate Kiss em Santa Maria. Saiba co... http://t.co/PMGNWUjp","","","","pt","","","","","","","","false","0","false","","","false","","0","","","","","","","","","","","","false","","","","false","","","false","296001197859536897","Antonio Campos","","<a href=""http://twitterfeed.com"" rel=""nofollow"">twitterfeed</a>","","","","","","pt","","","false","","","10730","","false","false","","","","","1","[http://bit.ly/T1oO9n]","","","","São Carlos / SP / BR.","0","","","","","-1","Campos_Tony","","","","2013-01-28T21:05:59.000Z","","",""
"576","115","Estadão","<a href=""http://twitter.com"" rel=""nofollow"">Twitter Web Client</a>","false","296068923365933057","67158511","2009-08-19T23:27:23.000Z","Teresina - PI","","Donos da boate Kiss devem responder por risco de morte, com pena de até 12 anos, indica promotoria: http://t.co/OTpbUONP","","","pt","pt","false","[9317502]","","282200","http://t.co/0egCJfYx8f","true","false","false","69","false","","11098","false","[http://migre.me/d11Tb]","4428","São Paulo","","","3","-1","","","Estadao","","","2013-01-29T01:35:06.000Z","false","","","","false","6143497","64336","false","296069225259352064","Sérgio Farias","9317502","<a href=""http://twitter.com"" rel=""nofollow"">Twitter Web Client</a>","2007-10-08T22:08:22.000Z","","A versão on-line do jornal O Estado de S.Paulo. Acompanhe também as atualizações pelo Facebook: http://t.co/HTvjzavEtw","","Donos da boate Kiss devem responder por risco de morte, com pena de até 12 anos, indica promotoria: http://t.co/OTpbUONP","pt","","RT @Estadao: Donos da boate Kiss devem responder por risco de morte, com pena de até 12 anos, indica promotoria: http://t.co/OTpbUONP","false","pt","","79703","","true","false","69","false","false","","14","[http://migre.me/d11Tb]","false","","26","","0","","","","","-1","sergiof_","","true","","2013-01-29T01:36:18.000Z","","[Estadao]","false"
"167","388","","","","","583311470","2012-05-18T00:45:36.000Z","A mudança na vida não é o fim da vida; é apenas o começo de uma nova etapa. 
Luiz Neto   João Miguel","","Ainda não me conformo!! #SantaMaria","","","","pt","","","","","","","","false","0","false","Maranhão, Brasil","","false","","89","","","","","","","","","","","","false","","","","false","","","false","296060467577769984","Joyce Marques","","<a href=""http://twitter.com"" rel=""nofollow"">Twitter Web Client</a>","","","","","","pt","","","false","","","1638","http://t.co/Tow1mm3fRs","true","false","","","","","0","","","","","Urucará, Amazonas","0","","[[-10.261845, -48.755147], [-10.261845, -41.795818], [-1.042441, -41.795818], [-1.042441, -48.755147]]","","[SantaMaria]","-1","joymarques18","","","","2013-01-29T01:01:30.000Z","","",""
"3","21","","","","","609672846","2012-06-16T01:40:10.000Z","I like rock, watch TV, surf the internet and eat!!! i admire Manu Gavassi, System of a Down, Miranda C. and Linkin Park","","Que Deus conforte cada familia da #tragedia #rs #santamaria #forçasantamaria","","","","pt","","","","","","","","false","0","false","","","false","","3","","","","","","","","","","","","false","","","","false","","","false","295942053966266368","Maria Alice Queiróz","","<a href=""http://twitter.com"" rel=""nofollow"">Twitter Web Client</a>","","","","","","pt","","","false","","","25","","false","false","","","","","0","","","","","","0","","","","[tragedia, rs, santamaria, forçasantamaria]","-1","Malicequeirz","","","","2013-01-28T17:10:58.000Z","","",""
"49","162","Demi Lovato","<a href=""http://twitter.com/download/iphone"" rel=""nofollow"">Twitter for iPhone</a>","false","295715679091429376","1095986816","2013-01-16T18:29:56.000Z","She is just everything to me ... one that makes me happy for each overrun in your life ...It helps me to be strong ...isn't it my princess @ddlovato ?(16 jan.)","","So sad to hear about the nightclub fire in Brazil. Such a tragedy. Praying for everyone affected down there.","","","en","en","false","[21111883]","","16891","https://t.co/f2jgasvk8i","true","false","false","44586","false","","101490","false","","21","DALLAS/LA","","","18656","-1","","","ddlovato","","","2013-01-28T02:11:26.000Z","false","","","","false","57101788","539","false","295948722926395394","Line","21111883","<a href=""http://twitter.com"" rel=""nofollow"">Twitter Web Client</a>","2009-02-17T18:02:08.000Z","","Singer, Songwriter, Actress, Entrepreneur, Philanthropist 💗 Listen to #FallInLine here: https://t.co/f2jgasvk8i","","So sad to hear about the nightclub fire in Brazil. Such a tragedy. Praying for everyone affected down there.","pt","","RT @ddlovato: So sad to hear about the nightclub fire in Brazil. Such a tragedy. Praying for everyone affected down there.","false","en","","455","","false","false","44586","false","false","","0","","false","","2068","","0","","","","","-1","gomesoliveira_","","true","","2013-01-28T17:37:28.000Z","","[ddlovato]","false"
"1069","1003","Gabs","<a href=""http://twitter.com"" rel=""nofollow"">Twitter Web Client</a>","false","296026565744148481","71389596","2009-09-03T23:18:17.000Z","Se acomode ou se incomode..","","""Bombeiros: os celulares não param de tocar nos bolsos das pessoas mortas e isso está doendo na gente."" #SantaMaria","","","pt","pt","false","[61119188]","","34527","","true","false","false","4","false","","0","false","","2044","PSherman 42 Wallaby Way Sidney","","","1","-1","","","Gabisimocelli","[SantaMaria]","","2013-01-28T22:46:47.000Z","false","","","","false","703","191","false","296026992824963072","Lelê ☪","61119188","<a href=""http://twitter.com/download/iphone"" rel=""nofollow"">Twitter for iPhone</a>","2009-07-29T05:07:39.000Z","","Livre é o meu jeito de ser, nasci e fui criada desse jeito meio louca e imperfeita não queira entender (8'","","""Bombeiros: os celulares não param de tocar nos bolsos das pessoas mortas e isso está doendo na gente."" #SantaMaria","pt","","RT @Gabisimocelli: ""Bombeiros: os celulares não param de tocar nos bolsos das pessoas mortas e isso está doendo na gente."" #SantaMaria","false","pt","","21099","","true","false","4","false","false","","21","","false","","41","snap: lecasciano","0","","","","[SantaMaria]","-1","leticiia_c","","false","","2013-01-28T22:48:29.000Z","","[Gabisimocelli]","false"
"60","143","","","","","188830369","2010-09-09T17:59:13.000Z","É necessário que ELE cresça e que eu diminua. 
João 3:30","","“…chorai com os que choram.” (Romanos 12:15) ... Hj é dia de chorar e orar pelos familiares das vitimas em #SantaMaria","","","","pt","","","","","","","","false","0","false","","","false","","3","","","","","","","","","","","","false","","","","false","","","false","296001445319282688","Patrícia C Barcellos","","<a href=""http://twitter.com"" rel=""nofollow"">Twitter Web Client</a>","","","","","","pt","","","false","","","276","http://t.co/I4H5roWwMx","false","false","","","","","0","","","","","","0","","","","[SantaMaria]","-1","patibarcellos1","","","","2013-01-28T21:06:58.000Z","","",""
"481","0","","","","","378143092","2011-09-22T18:21:20.000Z","Site que reúne as ofertas mais interessantes dos principais sites de venda do Brasil. Clique e economize","","Defensoria Pública pede bloqueio de bens de donos da boate Kiss: A Defensoria Pública do Rio Grande do Sul ajuiz... http://t.co/vzw5AvjA","","","","pt","","","","","","","","false","0","false","","","false","","0","","","","","","","","","","","","false","","","","false","","","false","296014548333367296","Gerente Maluco","","<a href=""http://twitterfeed.com"" rel=""nofollow"">twitterfeed</a>","","","","","","pt","","","false","","","633068","","false","false","","","","","16","[http://bit.ly/112UIl7]","","","","","0","","","","","-1","GerenteMaluco","","","","2013-01-28T21:59:02.000Z","","",""
"223","1147","","","","","266555777","2011-03-15T12:30:00.000Z","Always trying to better myself as a person as a woman. I love my family, they're everything to me especially my nephew Joseph and siblings they're my happiness.","","3 arrested in deadly Brazil nightclub fire: Police arrested three people and are hunting a fourth after a fire i... http://t.co/lQ8z0HtP","","","","en","","","","","","","","false","0","false","","","false","","0","","","","","","","","","","","","false","","","","false","","","false","295958269166501888","Asha Chael Brinney","","<a href=""http://twitterfeed.com"" rel=""nofollow"">twitterfeed</a>","","","","","","en","","","false","","","20168","","false","false","","","","","3","[http://bit.ly/111J5Ld]","","","","California","0","","","","","-1","asha_chael","","","","2013-01-28T18:15:24.000Z","","",""
"253","1336","","","","","740570678","2012-08-06T13:00:40.000Z","Free online community for the military and their families with forums and classifieds.","","Brazil police reportedly question 4 in nightclub fire http://t.co/AnPk2CPO","","","","en","","","","","","","","false","0","false","","","false","","1","","","","","","","","","","","","false","","","","false","","","false","296168248599252992","milListing","","<a href=""https://itunes.apple.com/us/app/feeddler-rss-reader-pro/id365710282?mt=8&uo=4"" rel=""nofollow"">Feeddler RSS Reader Pro on iOS</a>","","","","","","en","","","false","","","1288","http://t.co/9U531WIR","false","false","","","","","1","[http://binged.it/115xeLW]","","","","Global","0","","","","","-1","milListing","","","","2013-01-29T08:09:47.000Z","","",""
"176","159","","","","","578200899","2012-05-12T14:48:02.000Z","hope is very far","","@LudmilaCarreira vamos pra boate kiss","296052473305649153","","","pt","","[211381348]","","","","","","false","0","false","","","false","","900","","","","","","","LudmilaCarreira","","","","","false","","","","false","","","false","296053010105245697","isaac","","<a href=""http://store.ovi.com/content/256340"" rel=""nofollow"">Twitter for Nokia S40</a>","","","","","","pt","","","false","","","16431","http://t.co/0KTpegxiPt","false","false","","","","","0","","","","","NYC","0","211381348","","","","-1","versaac","","","","2013-01-29T00:31:52.000Z","","[LudmilaCarreira]",""
"693","573","Época","<a href=""http://bitly.com"" rel=""nofollow"">bitly bitlink</a>","false","296000820003106816","87482627","2009-11-04T17:05:09.000Z","Mermaid","","Google presta homenagem às vítimas do incêndio na boate Kiss http://t.co/3pq446ib","","","pt","pt","false","[21207962]","","98014","http://t.co/BMs9RlxovL","false","false","true","30","false","","6902","false","[http://glo.bo/WxzSs1]","1922","Brasil","","","2","-1","","","RevistaEpoca","","","2013-01-28T21:04:29.000Z","false","","","","false","2569688","59846","false","296001449509412865","Fe","21207962","<a href=""http://www.echofon.com/"" rel=""nofollow"">Echofon</a>","2009-02-18T15:51:35.000Z","","Site da Revista Época - Brasil, Sociedade, Mundo, Saúde, Ciência, Tecnologia, Negócios e Cultura.","","Google presta homenagem às vítimas do incêndio na boate Kiss http://t.co/3pq446ib","en","","RT @RevistaEpoca: Google presta homenagem às vítimas do incêndio na boate Kiss http://t.co/3pq446ib","false","pt","","45254","","true","false","30","false","false","","2","[http://glo.bo/WxzSs1]","false","","49","Atlântida","0","","","","","-1","feferibeiro_","","true","","2013-01-28T21:06:59.000Z","","[RevistaEpoca]","false"
"1160","632","Demi Lovato","<a href=""http://twitter.com/download/iphone"" rel=""nofollow"">Twitter for iPhone</a>","false","295715679091429376","120773585","2010-03-07T14:12:55.000Z","muscle up buttercup 🌹","","So sad to hear about the nightclub fire in Brazil. Such a tragedy. Praying for everyone affected down there.","","","en","en","false","[21111883]","","16891","https://t.co/f2jgasvk8i","true","false","false","44586","false","","101490","false","","12129","DALLAS/LA","","","18656","-1","","","ddlovato","","","2013-01-28T02:11:26.000Z","false","","","","false","57101788","539","false","296011394212577281","liza✨","21111883","<a href=""http://twitter.com/download/android"" rel=""nofollow"">Twitter for Android</a>","2009-02-17T18:02:08.000Z","","Singer, Songwriter, Actress, Entrepreneur, Philanthropist 💗 Listen to #FallInLine here: https://t.co/f2jgasvk8i","","So sad to hear about the nightclub fire in Brazil. Such a tragedy. Praying for everyone affected down there.","en","","RT @ddlovato: So sad to hear about the nightclub fire in Brazil. Such a tragedy. Praying for everyone affected down there.","false","en","","108949","","true","false","44586","false","false","","23","","false","","2068","","0","","","","","-1","Lizaaaxoxo","","true","","2013-01-28T21:46:30.000Z","","[ddlovato]","false"
"463","288","","","","","94091202","2009-12-02T13:38:54.000Z","WSIU Public Radio/TV Reporter and Anchor","","AP News - Neglect, errors to blame in Brazil nightclub fire http://t.co/pttxfUx7","","","","en","","","","","","","","false","0","false","","","false","","65","","","","","","","","","","","","false","","","","false","","","false","296015903072608258","Jennifer Fuller","","<a href=""http://itunes.apple.com/us/app/ap-mobile/id284901416?mt=8&uo=4"" rel=""nofollow"">AP Mobile on iOS</a>","","","","","","en","","","false","","","1533","https://t.co/NJQcjYT65Q","true","false","","","","","37","[http://apne.ws/WJNXDN]","","","","Carbondale, IL","0","","","","","-1","JFullerWSIU","","","","2013-01-28T22:04:25.000Z","","",""
"85","110","","","","","245749769","2011-02-01T11:38:18.000Z","Electronic Dance Music","","Over 200 die in kiss nightclub disaster. Only one exit!!! Planning regs need a serious review in brazil. Shame...","","","","en","","","","","","","","false","0","false","","","false","","0","","","","","","","","","","","","false","","","","false","","","false","295954443957043200","Element4records","","<a href=""https://mobile.twitter.com"" rel=""nofollow"">Twitter Lite</a>","","","","","","en","","","false","","","116","http://t.co/b6gn7WuDYP","false","false","","","","","4","","","","","United Kingdom","0","","","","","-1","Element4records","","","","2013-01-28T18:00:12.000Z","","",""
"59","284","Rodrigo Simas","<a href=""http://www.echofon.com/"" rel=""nofollow"">Echofon</a>","false","296051503830020096","506446593","2012-02-27T21:43:19.000Z","Desde o dia em que você apareceu, o resto do mundo se tornou totalmente desnecessário @Bruno_Ahmed 3","","Muita Luz para as vítimas e os familiares das vítimas da tragédia! Muito Triste ! #SantaMaria","","","en","pt","false","[66000819]","","7498","https://t.co/5k21tjhMzZ","false","false","false","566","false","","435","false","","35","","","","106","-1","","","simasrodrigo","[SantaMaria]","","2013-01-29T00:25:53.000Z","false","","","","false","1045573","388","false","296052083134717953","Pequeno Príncipe ∞","66000819","<a href=""http://twitter.com/download/android"" rel=""nofollow"">Twitter for Android</a>","2009-08-15T23:22:41.000Z","","Brasileiro.Carioca. Dream as if you'll live forever, live as if you'll die today.","","Muita Luz para as vítimas e os familiares das vítimas da tragédia! Muito Triste ! #SantaMaria","pt","","RT @simasrodrigo: Muita Luz para as vítimas e os familiares das vítimas da tragédia! Muito Triste ! #SantaMaria","false","pt","","1053","","true","false","566","false","false","","0","","false","","4","RJ l february 27, 2012 ","0","","","","[SantaMaria]","-1","mafiabrunoahmed","","true","","2013-01-29T00:28:11.000Z","","[simasrodrigo]","false"
"337","1978","Jornal O Globo","<a href=""http://www.hootsuite.com"" rel=""nofollow"">Hootsuite</a>","false","296201149403525120","241197814","2011-01-21T18:00:23.000Z","AME O PRÓXIMO COMO AMA A SI MESMO E NÃO DESEJE AO PRÓXIMO O QUE NÃO QUEIRA PARA SI . JESUS
snap: gfilho69
https://t.co/cnmU3OCeIN","","Sócios da boate Kiss têm ficha na polícia por agressão e estelionato. http://t.co/vG5Go3Vu","","","pt","pt","false","[54341363]","","311769","https://t.co/17A34NPUXT","true","false","false","70","false","","11212","false","[http://migre.me/d1hzP]","6848","","","","2","-1","","","JornalOGlobo","","","2013-01-29T10:20:31.000Z","false","","","","false","5641118","8154","false","296216353067646978","Gilberto S. Porto","54341363","<a href=""http://twitter.com"" rel=""nofollow"">Twitter Web Client</a>","2009-07-06T21:36:53.000Z","","Acompanhe as notícias do jornal O GLOBO pelas nossas newsletter","","Sócios da boate Kiss têm ficha na polícia por agressão e estelionato. http://t.co/vG5Go3Vu","pt","","RT @JornalOGlobo: Sócios da boate Kiss têm ficha na polícia por agressão e estelionato. http://t.co/vG5Go3Vu","false","pt","","12756","","true","false","70","false","false","","0","[http://migre.me/d1hzP]","false","","119","São Pedro do Sul-RS-BR","0","","","","","-1","tportofilhowite","","true","","2013-01-29T11:20:56.000Z","","[JornalOGlobo]","false"
"710","2036","","","","","472585179","2012-01-24T03:05:30.000Z","~coração~Jake Edwin Kennedy ~coração~","","#Chorando# cara, olha só o ultimo tuite da vítima la da boate Kiss. Só mais um futuro que não pode ser concluído!","","","","pt","","","","","","","","false","0","false","","","false","","193","","","","","","","","","","","","false","","","","false","","","false","295997842412150784","Angel","","<a href=""https://mobile.twitter.com"" rel=""nofollow"">Mobile Web (M2)</a>","","","","","","pt","","","false","","","12910","","false","false","","","","","0","","","","","","0","","","","","-1","jeiquebangui","","","","2013-01-28T20:52:39.000Z","","",""
"695","830","Demi Lovato","<a href=""http://twitter.com/download/iphone"" rel=""nofollow"">Twitter for iPhone</a>","false","295715679091429376","926078604","2012-11-04T20:24:32.000Z","lindissima, falou tudo.","","So sad to hear about the nightclub fire in Brazil. Such a tragedy. Praying for everyone affected down there.","","","en","en","false","[21111883]","","16891","https://t.co/f2jgasvk8i","true","false","false","44586","false","","101490","false","","3569","DALLAS/LA","","","18656","-1","","","ddlovato","","","2013-01-28T02:11:26.000Z","false","","","","false","57101788","539","false","296100296671780864","Jesus Rodrigo","21111883","<a href=""http://www.tweetcaster.com"" rel=""nofollow"">TweetCaster for Android</a>","2009-02-17T18:02:08.000Z","","Singer, Songwriter, Actress, Entrepreneur, Philanthropist 💗 Listen to #FallInLine here: https://t.co/f2jgasvk8i","","So sad to hear about the nightclub fire in Brazil. Such a tragedy. Praying for everyone affected down there.","pt","","RT @ddlovato: So sad to hear about the nightclub fire in Brazil. Such a tragedy. Praying for everyone affected down there.","false","en","","21505","","true","false","44586","false","false","","5","","false","","2068","Acre, Brasil","0","","","","","-1","querosalada_","","true","","2013-01-29T03:39:46.000Z","","[ddlovato]","false"
"22497","2368","","","","","14589617","2008-04-29T19:45:08.000Z","Comunicação @Cruzeiro | Popload |
Retuíto críticas.","","Tuitada do dia. RT @Assis_Thaisa
Menos boate Kiss, mais kiss.","","","","pt","","[45044660]","","","","","","false","1","false","","","false","","17472","","","","","","","","","","","","true","","","","false","","","false","296633774379257858","Alisson Guimarães","","<a href=""http://twitter.com"" rel=""nofollow"">Twitter Web Client</a>","","","","","","pt","","","false","","","79088","https://t.co/pimn5Xxtlc","true","false","","","","","136","","","","","Belo Horizonte, Brasil","0","","","","","-1","alisson10","","","","2013-01-30T14:59:37.000Z","","[Assis_Thaisa]",""
"2990","69","","","","","273988583","2011-03-29T14:21:01.000Z","Brazil Economics highlights daily economic news about Brazil for the English language reader.","","Neglect, errors to blame in Brazil nightclub fire – The Age http://t.co/I2xXQdm3 #brazil #currency","","","","en","","","","","","","","false","0","false","","","false","","7","","","","","","","","","","","","false","","","","false","","","false","296646466376712192","Brazil Economics","","<a href=""http://bufferapp.com"" rel=""nofollow"">Buffer</a>","","","","","","en","","","false","","","3766","http://t.co/4Tg7kYkX","false","false","","","","","132","[http://buff.ly/Xa4UXZ]","","","","","0","","","","[brazil, currency]","-1","BrazilEconomics","","","","2013-01-30T15:50:03.000Z","","",""
"627","1043","Fergie","<a href=""http://twitter.com"" rel=""nofollow"">Twitter Web Client</a>","false","295983434680107008","242952682","2011-01-25T23:56:10.000Z","Eu não preciso de muito para ser feliz. Eu nem sequer preciso de duas pernas. Mas eu sei ... que eu preciso de você.","","Envio minhas orações para as vítimas do incêndio no clube em #SantaMaria. O meu coração está com vocês #Brasil. ❤ #PrayForSantaMaria","","","en","pt","false","[245992215]","","3803","https://t.co/9yKbmksbnR","true","false","false","3118","false","","4755","false","","15519","Los Angeles, CA","","","879","-1","","","Fergie","[SantaMaria, Brasil, PrayForSantaMaria]","","2013-01-28T19:55:24.000Z","false","","","","false","4198534","629","false","296432447820816384","Evil Queen","245992215","<a href=""http://twitter.com/download/android"" rel=""nofollow"">Twitter for Android</a>","2011-02-01T22:15:24.000Z","","DOUBLE DUTCHESS: Seeing Double — The Visual Experience: https://t.co/yYH5zOT4jN","","Envio minhas orações para as vítimas do incêndio no clube em #SantaMaria. O meu coração está com vocês #Brasil. ❤ #PrayForSantaMaria","pt","","RT @Fergie: Envio minhas orações para as vítimas do incêndio no clube em #SantaMaria. O meu coração está com vocês #Brasil. ❤ #PrayForSa ...","false","pt","","16865","","true","false","3118","false","false","","0","","false","","5608","Sp - Cubatão","0","","","","[SantaMaria, Brasil]","-1","BEP_Bruna","","true","","2013-01-30T01:39:37.000Z","","[Fergie]","false"
