"2320","1612","","","","","961092336","2012-11-20T19:52:32.000Z","For leading #heroin coverage in Greater Cincinnati and Northern Kentucky, look to me.","","Boston marathon bombing suspect killed, another at large after explosions and gun fighting- @ky_enquirer","","","","en","","[505978388]","","","","","","false","0","false","","","false","","5293","","","","","","","","","","","","true","","","","false","","","false","325210305724563456","Terry DeMio","","<a href=""http://twitter.com/download/iphone"" rel=""nofollow"">Twitter for iPhone</a>","","","","","","en","","","false","","","9958","http://t.co/wpYRihiFru","true","false","","","","","106","","","","","@Enquirer","0","","","","","-1","tdemio","","","","2013-04-19T11:32:33.000Z","","[ky_enquirer]",""
"1019","2266","Professor Snape","<a href=""http://twitter.com"" rel=""nofollow"">Twitter Web Client</a>","false","325410727965908993","124950902","2010-03-21T04:36:23.000Z","Video @teamwaycreative - married to my best friend @_KyleWay - nonprofit friend/advocate - cat mom - MI beer & sports - bookworm - @FerrisState TDMP '09. ♥️💛","","Dzhokhar Tsarnaev is in custody. Bring him to Azkaban! #BostonManhunt #Manhunt","","","en","tl","false","[304185486]","","6586","","false","false","false","4080","false","","4894","false","","1634","email: snape@viralspark.net","","","1632","-1","","","_Snape_","[BostonManhunt, Manhunt]","","2013-04-20T00:48:58.000Z","false","","","","false","1405263","394","false","325411292586319872","Julie Way","304185486","<a href=""http://www.tweetcaster.com"" rel=""nofollow"">TweetCaster for Android</a>","2011-05-24T02:34:47.000Z","","There will be no foolish wand-waving or silly incantations in this Twitter feed.","","Dzhokhar Tsarnaev is in custody. Bring him to Azkaban! #BostonManhunt #Manhunt","en","","RT @_Snape_: Dzhokhar Tsarnaev is in custody. Bring him to Azkaban! #BostonManhunt #Manhunt","false","tl","","12965","","false","false","4080","false","false","","49","","false","","376","Grand Rapids, MI","0","","","","[BostonManhunt, Manhunt]","-1","wayjulez","","false","","2013-04-20T00:51:12.000Z","","[_Snape_]","false"
"7647","1056","","","","","96845928","2009-12-14T21:35:44.000Z","Im ME. that simple.. Publicist by day..scratch that.Publicist 24/7, Love to laugh, Love music, love the sun, my friends, my dogs and my fman & fam!","","#Watertown: Djohar Tsarnaev's profile. Last seen: yesterday at 8:04 pm http://t.co/YJ9BgVIWUr","","","","en","","","","","","","","false","5","false","","","false","","691","","[photo]","","","","","","","","","","false","","","","false","","","false","325213891854483456","Romina A Magorno","","<a href=""http://ubersocial.com"" rel=""nofollow"">UberSocial for iPhone</a>","","","","","","en","","","false","","","31066","","false","false","","","","","40","","","","","Everywhere you want to be!","0","","","","[Watertown]","-1","AllaboutROMI","","","[http://pbs.twimg.com/media/BINhJtRCcAE7Qy-.jpg]","2013-04-19T11:46:48.000Z","","",""
"4","35","","","","","1363528363","2013-04-19T03:54:08.000Z","I'm just a girl","","Suspect's father thinks they were set up.  Suspect's uncle says they did this because ""they're losers."" #bostonbombing #bostonmarathon","","","","en","","","","","","","","false","0","false","","","false","","1","","","","","","","","","","","","false","","","","false","","","false","325304530763935744","Duh Just Sayin","","<a href=""http://twitter.com"" rel=""nofollow"">Twitter Web Client</a>","","","","","","en","","","false","","","67","","false","false","","","","","0","","","","","somewhere in New England","0","","","","[bostonbombing, bostonmarathon]","-1","DuhJustSayin","","","","2013-04-19T17:46:58.000Z","","",""
"154","380","Professor Snape","<a href=""http://twitter.com"" rel=""nofollow"">Twitter Web Client</a>","false","325416373377458176","71763426","2009-09-05T09:08:40.000Z","","","Dzhokhar Tsarnaev's name rearranged is ""Hazard Over, Thanks."" You know who else had a rearranged name? Lord Voldemort. #BostonManhunt","","","en","en","false","[304185486]","","6586","","false","false","false","2247","false","","4894","false","","23912","email: snape@viralspark.net","","","1222","-1","","","_Snape_","[BostonManhunt]","","2013-04-20T01:11:24.000Z","false","","","","false","1405263","394","false","325416682266963970","Captain Marvelous Mrs. Maisel Williams","304185486","<a href=""http://twitter.com/download/android"" rel=""nofollow"">Twitter for Android</a>","2011-05-24T02:34:47.000Z","","There will be no foolish wand-waving or silly incantations in this Twitter feed.","","Dzhokhar Tsarnaev's name rearranged is ""Hazard Over, Thanks."" You know who else had a rearranged name? Lord Voldemort. #BostonManhunt","en","","RT @_Snape_: Dzhokhar Tsarnaev's name rearranged is ""Hazard Over, Thanks."" You know who else had a rearranged name? Lord Voldemort. #Boston…","false","en","","49197","","true","false","2247","false","false","","16","","false","","376","","0","","","","","-1","jhncyn","","false","","2013-04-20T01:12:37.000Z","","[_Snape_]","false"
"1357","1255","","","","","131704513","2010-04-11T02:44:42.000Z","Real nigga know the code baby, still open doors for the old ladies.","","As punishment for the suspect in the Boston bombings,they should shove a bomb up his ass","","","","en","","","","","","","","false","0","false","","","false","","912","","","","","","","","","","","","false","","","","false","","","false","325419341480878081","Manolo Rich","","<a href=""http://twitter.com/download/iphone"" rel=""nofollow"">Twitter for iPhone</a>","","","","","","en","","","false","","","28160","","true","false","","","","","10","","","","","Houston","0","","","","","-1","myslicklife","","","","2013-04-20T01:23:11.000Z","","",""
"369","702","","","","","51359375","2009-06-27T05:41:18.000Z","I'm social. I love cats and board games. Liberal Christian, feminist, cis, Proud auntie. My opinions are my own and not that of my employer.","","I will be so disappointed if Tsarnaev is killed.","","","","en","","","","","","","","false","0","false","","","false","","12887","","","","","","","","","","","","false","","","","false","","","false","325388756582543360","call me Nic","","<a href=""http://twitter.com"" rel=""nofollow"">Twitter Web Client</a>","","","","","","en","","","false","","","19550","https://t.co/DDe0hBEmgN","false","false","","","","","0","","","","","Pacific Northwest","0","","","","","-1","hi_its_nicola","","","","2013-04-19T23:21:39.000Z","","",""
"104","389","Boston.com","<a href=""https://about.twitter.com/products/tweetdeck"" rel=""nofollow"">TweetDeck</a>","false","325412518451351552","361416564","2011-08-24T19:11:31.000Z","This is who I am, this is how I am, and 95% of the time there isn’t a moral or a victory or silver lining. Take it or leave it.","","State official: Tsarnaev is ""Alive, conscious, captured.''","","","en","en","false","[14602259]","","189646","https://t.co/RPe2oVfaYR","true","false","false","191","false","","5578","false","","245","Boston, MA","","","25","-1","","","BostonDotCom","","","2013-04-20T00:56:04.000Z","false","","","","false","465105","2567","false","325412848673112064","Kerri Knapp","14602259","<a href=""http://twitter.com/download/iphone"" rel=""nofollow"">Twitter for iPhone</a>","2008-04-30T16:28:20.000Z","","What Boston really cares about right now.","","State official: Tsarnaev is ""Alive, conscious, captured.''","en","","RT @BostonDotCom: State official: Tsarnaev is ""Alive, conscious, captured.''","false","en","","2361","","false","false","191","false","false","","0","","false","","366","","0","","","","","-1","kerri_knapp","","true","","2013-04-20T00:57:23.000Z","","[BostonDotCom]","false"
"1139","2138","","","","","922300890","2012-11-03T03:00:33.000Z","A lot of Justin Bieber and Selena Gomez. Honestly, Hate humanity. #SpreadPeaceAndLove Together we can be the change #Senior18Bitch","","The song #Pray by Justin Bieber goes out to all the people that has lost someone in the bombing in #Boston! I pray for u! #PrayForBoston","","","","en","","","","","","","","false","0","false","","","false","","22533","","","","","","","","","","","","false","","","","false","","","false","325343927861387264","Peace & Love ✌&❤","","<a href=""http://twitter.com/download/android"" rel=""nofollow"">Twitter for Android</a>","","","","","","en","","","false","","","29905","","true","false","","","","","3","","","","","KC ","0","","","","[Pray, Boston, PrayForBoston]","-1","Emblems_rule_","","","","2013-04-19T20:23:31.000Z","","",""
"286","1484","America","<a href=""http://twitter.com/download/iphone"" rel=""nofollow"">Twitter for iPhone</a>","false","325359597554638850","37709770","2009-05-04T17:37:21.000Z","A Chicagoan and a lover of sports, food, movies, and life. 

Known to have been self described as dashing....","","Dzhokhar Tsarnaev, 

I have bad news for you. We never lose at Hide and Seek, just ask Bin Laden and Saddam. Good Luck.

Sincerely, 
America","","","en","en","false","[903161893]","","3392","","false","false","false","37507","false","","55","false","","39","USA","","","12579","-1","","","OurGreatAmerica","","","2013-04-19T21:25:47.000Z","false","","","","false","49057","1","false","325403281486647298","ChazGold","903161893","<a href=""http://twitter.com/download/iphone"" rel=""nofollow"">Twitter for iPhone</a>","2012-10-25T03:51:00.000Z","","twitaccts5@gmail.com","","Dzhokhar Tsarnaev, 

I have bad news for you. We never lose at Hide and Seek, just ask Bin Laden and Saddam. Good Luck.

Sincerely, 
America","en","","RT @OurGreatAmerica: Dzhokhar Tsarnaev, 

I have bad news for you. We never lose at Hide and Seek, just ask Bin Laden and Saddam. Good Luck…","false","en","","8477","","true","false","37507","false","false","","10","","false","","793","Chi-city","0","","","","","-1","ChazGold","","false","","2013-04-20T00:19:22.000Z","","[OurGreatAmerica]","false"
"337","200","SportsCenter","<a href=""https://about.twitter.com/products/tweetdeck"" rel=""nofollow"">TweetDeck</a>","false","325211296935075840","308886297","2011-06-01T04:57:19.000Z","How bout now? #IDGT","","BREAKING: Suspect #1 in Boston Marathon bombing shot and killed by police. Suspect #2 on the run, massive manhunt underway.","","","en","en","false","[26257166]","","103224","https://t.co/RqqkIx8GI7","true","false","false","12281","false","","44737","false","","5518","","","","1926","-1","","","SportsCenter","","","2013-04-19T11:36:29.000Z","false","","","","false","35761472","1661","false","325247211418034176","Kyle","26257166","<a href=""http://twitter.com/download/android"" rel=""nofollow"">Twitter for Android</a>","2009-03-24T15:28:02.000Z","","Download the ESPN App ⬇️","","BREAKING: Suspect #1 in Boston Marathon bombing shot and killed by police. Suspect #2 on the run, massive manhunt underway.","en","","RT @SportsCenter: BREAKING: Suspect #1 in Boston Marathon bombing shot and killed by police. Suspect #2 on the run, massive manhunt unde ...","false","en","","24599","","true","false","12281","false","false","","4","","false","","1139","Anchorage, AK","0","","","","","-1","lil_boy_kstone","","true","","2013-04-19T13:59:12.000Z","","[SportsCenter]","false"
"13494","951","HuffPost Politics","<a href=""https://about.twitter.com/products/tweetdeck"" rel=""nofollow"">TweetDeck</a>","false","325235013845147648","844234922","2012-09-24T20:16:18.000Z","Former journalist, Porschephile, wannabe golfer, lover of desert sunsets, wife, mom and Oba, brand ambassador for the Showroom at Furniture Row and FRR.","","RT @HuffingtonPost: The FBI has released a new photo of suspect Dzhokhar Tsarnaev http://t.co/tFQXn9rm1z","","","en","en","false","[15458694, 854402779879804928]","","287441","https://t.co/9Bl4PyLf2n","true","false","false","30","false","","16933","false","","3094","Washington, D.C.","[photo]","","5","-1","","","HuffPostPol","","[http://pbs.twimg.com/media/BIN3eTOCUAA3e-V.jpg]","2013-04-19T13:10:44.000Z","true","","[HuffingtonPost]","","false","1455677","8994","false","325243306512625664","Adele Arakawa","15458694","<a href=""http://twitter.com/download/iphone"" rel=""nofollow"">Twitter for iPhone</a>","2008-07-16T19:45:46.000Z","","The latest political news from HuffPost's politics team.","","RT @HuffingtonPost: The FBI has released a new photo of suspect Dzhokhar Tsarnaev http://t.co/tFQXn9rm1z","en","[854402779879804928]","RT @HuffPostPol: RT @HuffingtonPost: The FBI has released a new photo of suspect Dzhokhar Tsarnaev http://t.co/tFQXn9rm1z","false","en","","3804","","true","false","30","false","false","","199","","false","[photo]","125","Arizona","0","","","","","-1","AdeleArakawa","","true","[http://pbs.twimg.com/media/BIN3eTOCUAA3e-V.jpg]","2013-04-19T13:43:41.000Z","","[HuffPostPol, HuffingtonPost]","false"
"75","263","Ehab Z | إيهاب ز","<a href=""http://twitter.com/download/iphone"" rel=""nofollow"">Twitter for iPhone</a>","false","325243021346082816","265070485","2011-03-12T23:56:01.000Z","Law Student. Musician. Revolutionary.","","Boston suspect's twitter @Dzhokhar_ ... He doesn't seem like a terrorist.","","","en","en","false","[23227841, 2530886190]","","14683","https://t.co/nv87Q56XQ2","true","false","false","4","false","","162","false","","83","New York, NY","","","1","-1","","","EhabZ","","","2013-04-19T13:42:33.000Z","false","","[Dzhokhar_]","","false","2756","1342","false","325247878324969473","Mark Bryce","23227841","<a href=""http://twitter.com/download/android"" rel=""nofollow"">Twitter for Android</a>","2009-03-07T19:57:40.000Z","","Product Owner @Forbes | Former Digital News Producer at @AJAM | Basketball | NYC | فلسطين | Future food show host","","Boston suspect's twitter @Dzhokhar_ ... He doesn't seem like a terrorist.","en","[2530886190]","RT @EhabZ: Boston suspect's twitter @Dzhokhar_ ... He doesn't seem like a terrorist.","false","en","","2125","","false","false","4","false","false","","0","","false","","331","","0","","","","","-1","_HITtheMARK","","true","","2013-04-19T14:01:51.000Z","","[EhabZ, Dzhokhar_]","false"
"35","57","Boston.com","<a href=""http://www.hootsuite.com"" rel=""nofollow"">Hootsuite</a>","false","325409812600995840","22640573","2009-03-03T16:21:00.000Z","World Traveler, Pokemon Master, Savant","","BREAKING NEWS: Boston Marathon terror bombing suspect has been arrested.","","","en","en","false","[14602259]","","189646","https://t.co/RPe2oVfaYR","true","false","false","675","false","","5578","false","","32","Boston, MA","","","119","-1","","","BostonDotCom","","","2013-04-20T00:45:19.000Z","false","","","","false","465105","2567","false","325410667643416576","chrisray","14602259","<a href=""http://twitter.com/download/iphone"" rel=""nofollow"">Twitter for iPhone</a>","2008-04-30T16:28:20.000Z","","What Boston really cares about right now.","","BREAKING NEWS: Boston Marathon terror bombing suspect has been arrested.","en","","RT @BostonDotCom: BREAKING NEWS: Boston Marathon terror bombing suspect has been arrested.","false","en","","290","","true","false","675","false","false","","0","","false","","366","Boston","0","","","","","-1","chrisreyesss","","true","","2013-04-20T00:48:43.000Z","","[BostonDotCom]","false"
"690","832","","","","","244822955","2011-01-30T06:22:06.000Z","MiLB LHP
ECB Astros GT signee
Pitching Coach Geneva RedWings @pgcbl
Tallahassee, FL Go Seminoles","","""the suspect is normal kid, he used to hang out and smoke pot"" fox news guy just said about dzhokhar","","","","en","","","","","","","","false","3","false","","","false","","793","","","","","","","","","","","","false","","","","false","","","false","325406083256573954","Will West","","<a href=""http://twitter.com/#!/download/ipad"" rel=""nofollow"">Twitter for iPad</a>","","","","","","en","","","false","","","3564","","true","false","","","","","18","","","","","","0","","","","","-1","Will_West24","","","","2013-04-20T00:30:30.000Z","","",""
"478","799","Bran strowman","<a href=""http://twitter.com/download/iphone"" rel=""nofollow"">Twitter for iPhone</a>","false","325406946259787776","335059176","2011-07-14T02:45:11.000Z","","","They should put catch the terrorist mode in the next call of duty #boston","","","en","en","false","[258605043]","","34735","","true","false","false","2","false","","0","false","","14354","saratoga race track","","","2","-1","","","BIGGALLAGHER","[boston]","","2013-04-20T00:33:56.000Z","false","","","","false","370","415","false","325409480672149505","Mike Cesc⚽️⚽️","258605043","<a href=""http://twitter.com/download/android"" rel=""nofollow"">Twitter for Android</a>","2011-02-28T02:29:51.000Z","","","","They should put catch the terrorist mode in the next call of duty #boston","en","","RT @BIGGALLAGHER: They should put catch the terrorist mode in the next call of duty #boston","false","en","","17022","","true","false","2","false","false","","2","","false","","4155","Colonie","0","","","","[boston]","-1","Mikey_Cesc5","","false","","2013-04-20T00:44:00.000Z","","[BIGGALLAGHER]","false"
"7","4","","","","","1048032840","2012-12-30T14:41:00.000Z","","","Tersangka Bom Boston yang Tewas Bernama Tamerlan Tsarnaev: Identitas tersangka bom panci Boston mulai terungka... http://t.co/2sNyhbSZfo","","","","in","","","","","","","","false","0","false","","","false","","0","","","","","","","","","","","","false","","","","false","","","false","325227854717665280","bang","","<a href=""http://twitterfeed.com"" rel=""nofollow"">twitterfeed</a>","","","","","","en","","","false","","","23482","","false","false","","","","","0","[http://bit.ly/11JwqPs]","","","","","0","","","","","-1","bambang_taufik","","","","2013-04-19T12:42:17.000Z","","",""
"129","117","The Iron Sheik","<a href=""http://twitter.com"" rel=""nofollow"">Twitter Web Client</a>","false","325335319077593088","51320598","2009-06-27T02:41:15.000Z","I like the Dodgers, I Like the Lakers, I Like Nascar, I Like Craft Beer. I Hate In n Out.","","If the Dzhokhar Tsarnaev in front of me now I run over his mother than put the dumb bitch in camel clutch while Nikolai sing russia anthem","","","en","en","false","[68577152]","","21935","https://t.co/LguBDTiUUo","true","false","false","749","false","","4024","false","","4","USA Bubba","","","212","-1","","","the_ironsheik","","","2013-04-19T19:49:19.000Z","false","","","","false","516471","863","false","325353604150079488","BKM13","68577152","<a href=""http://twitterrific.com"" rel=""nofollow"">Twitterrific</a>","2009-08-25T01:59:15.000Z","","I AM THE LEGEND. WATCH MY MOVIE https://t.co/vpJizzNz0e #sheikmovie BUSINESS sheikshop@gmail.com OR YOU ARE BIG TIME JABRONI","","If the Dzhokhar Tsarnaev in front of me now I run over his mother than put the dumb bitch in camel clutch while Nikolai sing russia anthem","en","","RT @the_ironsheik: If the Dzhokhar Tsarnaev in front of me now I run over his mother than put the dumb bitch in camel clutch while Nikolai …","false","en","","15447","","false","false","749","false","false","","12","","false","","1321","Los Angeles","0","","","","","-1","BKM13LA","","true","","2013-04-19T21:01:58.000Z","","[the_ironsheik]","false"
"1062","613","","","","","501890229","2012-02-24T15:49:02.000Z","We will fight for liberty. We will defend the weak and oppressed. Peace Love and freedom for all. Scorpio   #OpCannabis #LegalizeIt","","URGENT: ""This is a set up, my son would never ever carry out such terror attack"" - Tsarnaev brothers' mother Zubeidat Tsarnaeva","","","","en","","","","","","","","false","0","false","","","false","","1447","","","","","","","","","","","","false","","","","false","","","false","325333064614039554","Anonymous","","<a href=""http://twitter.com"" rel=""nofollow"">Twitter Web Client</a>","","","","","","en","","","false","","","9720","https://t.co/QMzDgoep6A","false","false","","","","","22","","","","","No where But Everywhere","0","","","","","-1","Anonymous_Newz","","","","2013-04-19T19:40:21.000Z","","",""
"1521","496","andrew kaczynski🤔","<a href=""http://twitter.com/download/iphone"" rel=""nofollow"">Twitter for iPhone</a>","false","325377945722040321","24712774","2009-03-16T15:50:31.000Z","Husband to Katie and father two little girls. Texpat. Felafel connoisseur. VP for Public Policy and General Counsel for @ERLC.","","RT @CBSNews: FBI now acknowledges they interviewed Tsarnaev 2 years ago at the request of a foreign country about possible extremist ties.","","","en","en","false","[782351672639094785, 15012486]","","132743","https://t.co/oSGSbsz3Us","true","false","false","159","false","","7086","false","","1210","New York, USA","","","21","-1","","","KFILE","","","2013-04-19T22:38:42.000Z","false","","[CBSNews]","","false","285790","4417","false","325405613511286785","Travis Wussow","326255267","<a href=""http://tapbots.com/tweetbot"" rel=""nofollow"">Tweetbot for iOS</a>","2011-06-29T16:44:57.000Z","","Reporter at CNN's KFile. Challenged to a duel by @RandPaul. “Flex Cam” winner at a @BrooklynNets game. Likes cats. Andrew.w.Kaczynski@gmail.com","","RT @CBSNews: FBI now acknowledges they interviewed Tsarnaev 2 years ago at the request of a foreign country about possible extremist ties.","en","[15012486]","RT @BuzzFeedAndrew: RT @CBSNews: FBI now acknowledges they interviewed Tsarnaev 2 years ago at the request of a foreign country about possi…","false","en","","3078","","true","false","159","false","false","","40","","false","","35224","Washington, DC","0","","","","","-1","traviswussow","","true","","2013-04-20T00:28:38.000Z","","[BuzzFeedAndrew, CBSNews]","false"
"1108","261","Deadspin","<a href=""http://www.socialflow.com"" rel=""nofollow"">SocialFlow</a>","false","325370430691110912","33138758","2009-04-19T05:20:48.000Z","RE/MAX Calgary, AB-- I enjoy tracking and talking about real estate market trends. Love sports. #Flames & #Colts are my teams. Great Family with 3 young kids.","","VIDEO: CNN on an empty Boston: ""It's as though a bomb had dropped."" Oh? http://t.co/NqkoDGYd2s","","","en","en","false","[13213122]","","84821","http://t.co/mhAF2P6Jmb","false","false","false","473","false","","13494","false","[http://deadsp.in/2XAksch]","172","","","","133","-1","","","Deadspin","","","2013-04-19T22:08:50.000Z","false","","","","false","1085456","1489","false","325385854140940288","Colin Kehler","13213122","<a href=""http://twitter.com/download/iphone"" rel=""nofollow"">Twitter for iPhone</a>","2008-02-07T17:38:57.000Z","","Sports News without Access, Favor, or Discretion. Contact us: tips@deadspin.com.","","VIDEO: CNN on an empty Boston: ""It's as though a bomb had dropped."" Oh? http://t.co/NqkoDGYd2s","en","","RT @Deadspin: VIDEO: CNN on an empty Boston: ""It's as though a bomb had dropped."" Oh? http://t.co/NqkoDGYd2s","false","en","","5455","https://t.co/8oeo8bQM6a","true","false","473","false","false","","0","[http://deadsp.in/2XAksch]","false","","69","Calgary, Alberta","0","","","","","-1","Kehler_Realtor","","true","","2013-04-19T23:10:07.000Z","","[Deadspin]","false"
"549","278","","","","","101092953","2010-01-02T00:22:23.000Z","Taylor Swift, cute animals and country music are my favorite // REP TOUR MetLife 1, 2, 3 & Nashville","","THIS IS DZHOKHAR'S ACTUAL TWITTER WTF https://t.co/KnQO5STGlF","","","","lv","","","","","","","","false","0","false","","","false","","2005","","","","","","","","","","","","false","","","","false","","","false","325289477432016898","Marta","","<a href=""http://twitter.com"" rel=""nofollow"">Twitter Web Client</a>","","","","","","en","","","false","","","26974","","false","false","","","","","36","[https://twitter.com/J_tsar]","","","","NYC","0","","","","","-1","marta_k29","","","","2013-04-19T16:47:09.000Z","","",""
"1076","1187","r.h. Sin","<a href=""http://twitter.com"" rel=""nofollow"">Twitter Web Client</a>","false","325272614622871552","318593563","2011-06-16T18:45:06.000Z","♬♬♪♪♩♩☜my life.                    Director of YVP                              President of The Vesper Choir             Phi Mu Alpha Spring '16 #OASAASLLS","","Bombing suspect Dzhokhar Tsarnaev received US citizenship on Sept 11, 2012 -- 11 yrs to the day after 9/11 attacks. #manhunt","","","en","en","false","[3198495413]","","83138","https://t.co/4UH2SCUU7H","true","false","false","147","false","","5225","false","","421","New York","","","25","-1","","","byRHSin","[manhunt]","","2013-04-19T15:40:09.000Z","false","","","","false","644406","1","false","325273044140580865","R.WADE","109970442","<a href=""http://twitter.com/download/android"" rel=""nofollow"">Twitter for Android</a>","2010-01-30T22:09:34.000Z","","a husband first | New York Times Best-Selling Author","","Bombing suspect Dzhokhar Tsarnaev received US citizenship on Sept 11, 2012 -- 11 yrs to the day after 9/11 attacks. #manhunt","en","","RT @iTweetFacts: Bombing suspect Dzhokhar Tsarnaev received US citizenship on Sept 11, 2012 -- 11 yrs to the day after 9/11 attacks. #ma ...","false","en","","34892","","true","false","147","false","false","","1","","false","","8080","","0","","","","","-1","DeSteven2011","","false","","2013-04-19T15:41:51.000Z","","[iTweetFacts]","false"
