"611","867","garota ciúme","<a href=""http://twitter.com"" rel=""nofollow"">Twitter Web Client</a>","false","295552644246827008","907136599","2012-10-27T01:28:34.000Z","You need me but i dont need you haha ♡","","O que nós temos que lembrar é que no céu hoje, chegaram mais 245 estrelas! #TODOSDesejamForçasASantaMaria #SantaMaria","","","pt","pt","false","[206181302]","","28338","https://t.co/y77jbUByV0","true","false","false","328","false","","865","false","","1401","Recife, Brasil","","","15","-1","","","GarotaCiume","[TODOSDesejamForçasASantaMaria, SantaMaria]","","2013-01-27T15:23:36.000Z","false","","","","false","2443369","108","false","295552734470492160","WELCOME TO BRAZIL 1D","206181302","<a href=""http://twitter.com/download/iphone"" rel=""nofollow"">Twitter for iPhone</a>","2010-10-22T12:52:10.000Z","","ciúme é igual a bater o dedinho do pé no sofá: coisa boba, mas dói demais. * fan account * contatogarotaciume@gmail.com 💌","","O que nós temos que lembrar é que no céu hoje, chegaram mais 245 estrelas! #TODOSDesejamForçasASantaMaria #SantaMaria","pt","","RT @GarotaCiume: O que nós temos que lembrar é que no céu hoje, chegaram mais 245 estrelas! #TODOSDesejamForçasASantaMaria #SantaMaria","false","pt","","21818","","true","false","328","false","false","","1","","false","","56693","di4monds ","0","","","","[TODOSDesejamForçasASantaMaria, SantaMaria]","-1","Ietsgotonandos","","false","","2013-01-27T15:23:57.000Z","","[GarotaCiume]","false"
"461","549","Gabi Chanas","<a href=""http://www.facebook.com/twitter"" rel=""nofollow"">Facebook</a>","false","295517220291874817","36452654","2009-04-29T19:31:18.000Z","Pisciano, teimoso, determinado, instável e futuro economista.","","De tudo que ouvi, o relato que mais me partiu o coração: os celulares dos mortos não param de tocar. #SantaMaria","","","pt","pt","false","[17865061]","","65903","https://t.co/aVVTybtQ7p","true","false","false","1075","false","","158","false","","2777","São Paulo, Brasil","","","28","-1","","","gabichanas","[SantaMaria]","","2013-01-27T13:02:50.000Z","false","","","","false","20774","2713","false","295558669406457856","angel","17865061","<a href=""http://twitter.com"" rel=""nofollow"">Twitter Web Client</a>","2008-12-04T10:41:43.000Z","","Journalist. Digital enthusiast. Dog lover. Terrible cooker.","","De tudo que ouvi, o relato que mais me partiu o coração: os celulares dos mortos não param de tocar. #SantaMaria","en","","RT @gabichanas: De tudo que ouvi, o relato que mais me partiu o coração: os celulares dos mortos não param de tocar. #SantaMaria","false","pt","","38133","http://t.co/YWyl0ZFZP9","true","false","1075","false","false","","4","","false","","573","Rio de Janeiro ","0","","","","[SantaMaria]","-1","Angelo__Bruno","","false","","2013-01-27T15:47:32.000Z","","[gabichanas]","false"
"965","1398","","","","","316817033","2011-06-14T00:49:38.000Z","SINCE:11/09/2011 Twitter Dedicado:@Lua_Blanco @melfronckowiak @sophiaabrahao @chayleao @aguiarthur @MicaelBorges_ ♥Ofc : @Szafiroficial @Beca_Cruz","","Quantas vidas foram tiradas, sonhos foram perdidos... Que Deus conforte os familiares, nesse momento tão triste e desesperador #SantaMaria","","","","pt","","","","","","","","false","1","false","","","false","","468","","","","","","","","","","","","false","","","","false","","","false","295566420501217280","Rebelde Para Sempre","","<a href=""http://twitter.com"" rel=""nofollow"">Twitter Web Client</a>","","","","","","pt","","","false","","","25686","","true","false","","","","","2","","","","","","0","","","","[SantaMaria]","-1","AmoLuAr_Willy","","","","2013-01-27T16:18:20.000Z","","",""
"1562","637","","","","","99397449","2009-12-26T01:40:01.000Z","Millenial. Happy pill. IG: dealwithchino","","Oh no! :( @rapplerdotcom: More than 150 dead in Brazil nightclub fire. Read: http://t.co/4rJNknLh","","","","en","","[330826792]","","","","","","false","0","false","","","false","","19","","","","","","","","","","","","false","","","","false","","","false","295570367320305665","Chino Bautista","","<a href=""http://blackberry.com/twitter"" rel=""nofollow"">Twitter for BlackBerry®</a>","","","","","","en","","","false","","","42072","https://t.co/kXGZJ3FfK5","true","false","","","","","4","[http://rplr.co/YwSiyZ]","","","","MNL","0","","","","","-1","supremechino","","","","2013-01-27T16:34:01.000Z","","[rapplerdotcom]",""
"123","26","mariana","<a href=""http://twitter.com"" rel=""nofollow"">Twitter Web Client</a>","false","295570667418562561","928693956","2012-11-06T00:41:17.000Z","i'm here for you @onedirection","","`alô a senhora poderia vir a boate Kiss para reconhecer o corpo do seu filho?` CARALHO, COMO ISSO DEVE DOER.","","","en","pt","false","","","32054","","true","false","false","104","false","","33","false","","92","","","","1","-1","","","brokensclock","","","2013-01-27T16:35:13.000Z","false","","","","false","3289","838","false","295571780809134080","horan","589347792","<a href=""http://twitter.com/download/iphone"" rel=""nofollow"">Twitter for iPhone</a>","2012-05-24T16:59:04.000Z","","amy santiago, will you marry me?","","`alô a senhora poderia vir a boate Kiss para reconhecer o corpo do seu filho?` CARALHO, COMO ISSO DEVE DOER.","pt","","RT @h0ran4ttack: `alô a senhora poderia vir a boate Kiss para reconhecer o corpo do seu filho?` CARALHO, COMO ISSO DEVE DOER.","false","pt","","6159","","false","false","104","false","false","","0","","false","","2177","rj ","0","","","","","-1","sosni4ll","","false","","2013-01-27T16:39:38.000Z","","","false"
"4635","4996","Jornal da CBN","<a href=""https://about.twitter.com/products/tweetdeck"" rel=""nofollow"">TweetDeck</a>","false","295566493050093569","274268595","2011-03-30T01:43:25.000Z","O BRASIL SOMENTE  TERÁ UMA DEMOCRACIA VERDADEIRA SE REALMENTE LULA FOR PARA CADEIA POR UM LARGO TEMPO.","","Rodoviária de Porto Alegre confirma pelo seu twitter @rodoviariapoa ônibus extras para #SantaMaria","","","pt","pt","false","[44924110, 282600482]","","32416","http://t.co/nxD4rI8DpZ","true","false","false","23","false","","2672","false","","84246","Brasil","","","0","-1","","","jornaldacbn","[SantaMaria]","","2013-01-27T16:18:37.000Z","false","","[rodoviariapoa]","","false","504040","2341","false","295567020278304769","INTERVENÇÃO URGENTE!","44924110","<a href=""http://twitter.com/download/iphone"" rel=""nofollow"">Twitter for iPhone</a>","2009-06-05T16:02:09.000Z","","Jornal da CBN - As notícias que podem mudar o seu dia. Todos os dias na Rádio CBN, a partir das 6h. Apresentação: @miltonjung","","Rodoviária de Porto Alegre confirma pelo seu twitter @rodoviariapoa ônibus extras para #SantaMaria","pt","[282600482]","RT @jornaldacbn: Rodoviária de Porto Alegre confirma pelo seu twitter @rodoviariapoa ônibus extras para #SantaMaria","false","pt","","248815","https://t.co/zHShwP6BLZ","false","false","23","false","false","","79","","false","","319","BRASIL-SÃO PAULO","0","","","","[SantaMaria]","-1","FATIMASSAURO","","true","","2013-01-27T16:20:43.000Z","","[jornaldacbn, rodoviariapoa]","false"
"3090","815","A lá machado","<a href=""http://twitter.com"" rel=""nofollow"">Twitter Web Client</a>","false","295566191081172994","305284118","2011-05-25T23:25:59.000Z","Como melhorar a educação, a ciência e a vida no Brasil? Scientia Vinces ------------ https://t.co/lmAvzhxXP4","","#SantaMaria Meu coração e minhas orações estão com vocês... não tem como nao sentir um vazio mesmo nao tendo familiares na tragedia....","","","pt","pt","false","[191196879]","","6229","","false","false","false","2","false","","1","false","","3194","","","","0","-1","","","fernandesml01","[SantaMaria]","","2013-01-27T16:17:25.000Z","false","","","","false","285","855","false","295568551220228097","Gilson Volpato","191196879","<a href=""http://twitter.com"" rel=""nofollow"">Twitter Web Client</a>","2010-09-15T21:00:17.000Z","","🙅 Sweet as lemon! 🍋","","#SantaMaria Meu coração e minhas orações estão com vocês... não tem como nao sentir um vazio mesmo nao tendo familiares na tragedia....","pt","","RT @fernandesml01: #SantaMaria Meu coração e minhas orações estão com vocês... não tem como nao sentir um vazio mesmo nao tendo familiar ...","false","pt","","13509","https://t.co/lmAvzhxXP4","true","false","2","false","false","","38","","false","","1077","Botucatu - SP","0","","","","[SantaMaria]","-1","GilsonVolpato","","false","","2013-01-27T16:26:48.000Z","","[fernandesml01]","false"
"1105","1913","","","","","46971571","2009-06-13T21:53:51.000Z","","","Deus espalhe sua misericórdia.#SantaMaria","","","","pt","","","","","","","","false","1","false","Luís Correia, Brasil","","false","","87","","","","","","","","","","","","false","","","","false","","","false","295572808401047552","Raquel Taveira","","<a href=""http://twitter.com"" rel=""nofollow"">Twitter Web Client</a>","","","","","","pt","","","false","","","36103","","true","false","","","","","35","","","","","fortaleza ","0","","[[-3.3499313, -41.713397], [-3.3499313, -41.2563146], [-2.873554, -41.2563146], [-2.873554, -41.713397]]","","[SantaMaria]","-1","keldeamor","","","","2013-01-27T16:43:43.000Z","","",""
"1301","1603","","","","","44401810","2009-06-03T17:05:25.000Z","Eternal romantic and dreamer realist that knows up to where it should go. Linked in the beauty, partnership, complicity and technology!","","@pires_cleo Programação da Boate Kiss de Santa Maria neste sábado 26/01, noite da tragédia: http://t.co/BSzkAzYM","295568306449027073","","","pt","","[783425628225830912]","","","","","","false","0","false","","","false","","3819","","[photo]","","","","","cleooficial","","","","","false","","","","false","","","false","295569830482935809","Julio Mendes","","<a href=""http://twitter.com"" rel=""nofollow"">Twitter Web Client</a>","","","","","","pt","","","false","","","25924","","true","false","","","","","9","","","","","Brasil - Rio de Janeiro","0","275220311","","","","-1","_JulioMendes_","","","[http://pbs.twimg.com/media/BBoLt6ICUAEIQ60.jpg]","2013-01-27T16:31:53.000Z","","[pires_cleo]",""
"494","189","triz","<a href=""http://twitter.com"" rel=""nofollow"">Twitter Web Client</a>","false","295552791525605379","1011814045","2012-12-14T19:29:24.000Z","","","#TODOSDesejamForçasASantaMaria #PrayForSantaMaria #SantaMaria #TWFanmilyDesejaForçasASantaMaria Desejo todo o consolo do mundo :/","","","pt","pt","false","[635536020]","","49397","https://t.co/F24UREu1Lx","true","false","false","6","false","","8","false","","139","upside down","","","0","-1","","","twfanmiIy","[TODOSDesejamForçasASantaMaria, PrayForSantaMaria, SantaMaria, TWFanmilyDesejaForçasASantaMaria]","","2013-01-27T15:24:11.000Z","false","","","","false","4885","2891","false","295553208439406592","Gabrielle Batista","635536020","<a href=""https://mobile.twitter.com"" rel=""nofollow"">Mobile Web (M2)</a>","2012-07-14T15:28:10.000Z","","✨May 20, 2016 / September 16, 2017✨  ♡ the wanted, id, the killers, stranger things, himym, hp e friends ♡","","#TODOSDesejamForçasASantaMaria #PrayForSantaMaria #SantaMaria #TWFanmilyDesejaForçasASantaMaria Desejo todo o consolo do mundo :/","pt","","RT @TWFanmiIy: #TODOSDesejamForçasASantaMaria #PrayForSantaMaria #SantaMaria #TWFanmilyDesejaForçasASantaMaria Desejo todo o consolo do  ...","false","pt","","8721","","true","false","6","false","false","","1","","false","","2653","Brasil","0","","","","[TODOSDesejamForçasASantaMaria, PrayForSantaMaria, SantaMaria, TWFanmilyDesejaForçasASantaMaria]","-1","Gabss_Batista","","false","","2013-01-27T15:25:50.000Z","","[twfanmiIy]","false"
"479","1497","100% BELIEBER","<a href=""http://twitter.com"" rel=""nofollow"">Twitter Web Client</a>","false","295549026714140673","770150696","2012-08-20T20:14:05.000Z","Hi :)
I'm addicted to Nina Dobrev and Vampire Diaries, I also love Selena Gomez and Victoria Justice. And PLL #Dobrevic #TVDFamily #Selenator #Victorian","","If you hate Brazil, forget it. They need your support! 245 teenagers dead in nightclub fire in southern Brazil... #PrayForSantaMaria","","","pl","en","false","[864945564]","","770","","false","false","false","834","false","","1","false","","289","","","","73","-1","","","100BELIEBER16","[PrayForSantaMaria]","","2013-01-27T15:09:13.000Z","false","","","","false","433","1755","false","295559856415453184","Océane.","864945564","<a href=""http://twitter.com"" rel=""nofollow"">Twitter Web Client</a>","2012-10-06T16:35:27.000Z","","With Kidrauhl since I remeber ♥  #loveforever","","If you hate Brazil, forget it. They need your support! 245 teenagers dead in nightclub fire in southern Brazil... #PrayForSantaMaria","fr","","RT @100BELIEBER16: If you hate Brazil, forget it. They need your support! 245 teenagers dead in nightclub fire in southern Brazil... #Pr ...","false","en","","971","","false","false","834","false","false","","1","","false","","182","Saint-Barthélemy","0","","","","","-1","TVDobrevic4ever","","false","","2013-01-27T15:52:15.000Z","","[100BELIEBER16]","false"
"89","162","","","","","157411166","2010-06-19T18:42:14.000Z","pecador, em transformação, alçando pela graça divina. Filho, Esposo, Pai, Amigo. membro da Igreja Presbiteriana da Vila Prudente.","","senhor ajudamos a suportar a dor, que o seu consolo venha sobre todos de #SantaMARIA  #TODOSDesejamForçasASantaMaria","","","","pt","","","","","","","","false","0","false","","","false","","171","","","","","","","","","","","","false","","","","false","","","false","295557708919209984","Ricardo Camilo Rodr","","<a href=""http://twitter.com"" rel=""nofollow"">Twitter Web Client</a>","","","","","","pt","","","false","","","8536","","true","false","","","","","0","","","","","Vila Prudente, São Paulo","0","","","","[SantaMARIA, TODOSDesejamForçasASantaMaria]","-1","Ricardo__Camilo","","","","2013-01-27T15:43:43.000Z","","",""
"2093","99","","","","","388006766","2011-10-10T01:14:13.000Z","Tô trancando aqui no quarto de pijama, porque tem visita estranha na sala, aí eu pego e passo a vista no jornal.","","Desejo Forças para todos, sem palavras... #SantaMaria","","","","pt","","","","","","","","false","0","false","","","false","","240","","","","","","","","","","","","false","","","","false","","","false","295552075989925888","anurb","","<a href=""http://twitter.com"" rel=""nofollow"">Twitter Web Client</a>","","","","","","pt","","","false","","","20233","https://t.co/Bw5lIUUafY","true","false","","","","","1","","","","","Campinas, Brasil","0","","","","[SantaMaria]","-1","_gualtieri","","","","2013-01-27T15:21:20.000Z","","",""
"1435","1503","","","","","184241680","2010-08-29T01:55:34.000Z","- WWE -  @TheShieldWWE | The Walking Dead | Vikings |  Sou quem não te abandonou @Gremio","","tu não os ve tu não os toca mas estão presentes, vários momentos inesqueciveis me veem a mente ♪
#SantaMaria","","","","pt","","","","","","","","false","1","false","","","false","","16644","","","","","","","","","","","","false","","","","false","","","false","295561903239991298","Gustavo","","<a href=""http://twitter.com"" rel=""nofollow"">Twitter Web Client</a>","","","","","","pt","","","false","","","47217","","false","false","","","","","7","","","","","Canoas, Rio Grande do Sul","0","","","","[SantaMaria]","-1","Gustavo_GFBPA","","","","2013-01-27T16:00:23.000Z","","",""
"22650","24840","","","","","17233536","2008-11-07T16:19:51.000Z","expect uncensored truth in my timeline. If you don't agree, speak up. But be prepared for a debate  #MAGA #SGP #TrumpTrain #TCOT #IStandWithIsrael #HonorOurVets","","Pictures of tragic fire in Brazil- 245 fatalities!!  Mail Online http://t.co/IHruwFBr #BRAZIL","","","","en","","","","","","","","false","0","false","","","false","","53103","","","","","","","","","","","","false","","","","false","","","false","295555376873607168","Color Me Red","","<a href=""https://dev.twitter.com/docs/tfw"" rel=""nofollow"">Twitter for Websites</a>","","","","","","en","","","false","","","341372","https://t.co/PTeWFHh6db","true","false","","","","","687","[http://www.dailymail.co.uk/ushome/index.html]","","","","*RTs are NOT endorsements*","1","","","","[BRAZIL]","-1","ColorMeRed","","","","2013-01-27T15:34:27.000Z","","",""
"237","133","garota ciúme","<a href=""http://twitter.com"" rel=""nofollow"">Twitter Web Client</a>","false","295552644246827008","356300170","2011-08-16T17:00:57.000Z","","","O que nós temos que lembrar é que no céu hoje, chegaram mais 245 estrelas! #TODOSDesejamForçasASantaMaria #SantaMaria","","","pt","pt","false","[206181302]","","28338","https://t.co/y77jbUByV0","true","false","false","328","false","","865","false","","13","Recife, Brasil","","","15","-1","","","GarotaCiume","[TODOSDesejamForçasASantaMaria, SantaMaria]","","2013-01-27T15:23:36.000Z","false","","","","false","2443369","108","false","295552872911884288","Brubs ;9","206181302","<a href=""http://twitter.com"" rel=""nofollow"">Twitter Web Client</a>","2010-10-22T12:52:10.000Z","","ciúme é igual a bater o dedinho do pé no sofá: coisa boba, mas dói demais. * fan account * contatogarotaciume@gmail.com 💌","","O que nós temos que lembrar é que no céu hoje, chegaram mais 245 estrelas! #TODOSDesejamForçasASantaMaria #SantaMaria","pt","","RT @GarotaCiume: O que nós temos que lembrar é que no céu hoje, chegaram mais 245 estrelas! #TODOSDesejamForçasASantaMaria #SantaMaria","false","pt","","22382","","true","false","328","false","false","","0","","false","","56693","brasil","0","","","","[TODOSDesejamForçasASantaMaria, SantaMaria]","-1","veronica_bruna","","false","","2013-01-27T15:24:30.000Z","","[GarotaCiume]","false"
"508","387","SBT","<a href=""http://twitter.com"" rel=""nofollow"">Twitter Web Client</a>","false","295560697184657408","345634140","2011-07-30T22:51:12.000Z","http://t.co/S96CotE9iB","","Nossa solidariedade às famílias de #SantaMaria e a todos os gaúchos neste domingo triste.","","","pt","pt","false","[3525618855]","","36830","https://t.co/z1WRLmjIWI","false","false","false","42","false","","467","false","","7042","Facebook","","","1","-1","","","SBTOficialFas","[SantaMaria]","","2013-01-27T15:55:36.000Z","false","","","","false","654653","171","false","295561282474606592","Gabriella","45433082","<a href=""http://twitter.com"" rel=""nofollow"">Twitter Web Client</a>","2009-06-07T21:57:41.000Z","","Fan account. Este perfil não é afiliado ao SBT. Siga o perfil institucional oficial @SBTOnline. SBT Fãs.","","Nossa solidariedade às famílias de #SantaMaria e a todos os gaúchos neste domingo triste.","pt","","RT @SBTOficial: Nossa solidariedade às famílias de #SantaMaria e a todos os gaúchos neste domingo triste.","false","pt","","28253","http://t.co/0h7n3PfaaG","true","false","42","false","false","","3","","false","","10","Itabira-MG","0","","","","[SantaMaria]","-1","Gabi_FAndrade","","false","","2013-01-27T15:57:55.000Z","","[SBTOficial]","false"
"3197","1652","","","","","329212640","2011-07-04T18:19:00.000Z","O bom de ser fã do Luan Santana, é que ele  olha para uma fã e três ficam feliz ao mesmo tempo  ! 02.07.16•Luan curtiu 31.10.16 ♡","","Já chegou em 245 o calculo de mortos no incêndio na boate Kiss Em Santa Maria .Que deus ilumine todos las , que de mt mt força #SantaMaria","","","","pt","","","","","","","","false","2","false","","","false","","540","","","","","","","","","","","","false","","","","false","","","false","295563396387069952","LUAN SEGUE EU ❤️ NAY","","<a href=""http://twitter.com"" rel=""nofollow"">Twitter Web Client</a>","","","","","","pt","","","false","","","51202","https://t.co/ZLfO5CAXUa","true","false","","","","","23","","","","","Vesgo não tem direção ","0","","","","[SantaMaria]","-1","PortalSantana","","","","2013-01-27T16:06:19.000Z","","",""
"621685","1416","","","","","52724486","2009-07-01T13:27:28.000Z","Luiz Halan não merece a morte, tenho que ficar pra semente pois a humanidade me merece !!!!  Tel: 21 992440480","","Celso Portiolli pegou a Bruna para ser a Rainha da Desgraça ? É isso mesmo #Produção ????? #DomingoLegal #SantaMaria","","","","pt","","","","","","","","false","0","false","","","false","","7795","","","","","","","","","","","","false","","","","false","","","false","295573454357405697","Luiz Halan","","<a href=""https://about.twitter.com/products/tweetdeck"" rel=""nofollow"">TweetDeck</a>","","","","","","pt","","","false","","","359082","","true","false","","","","","61","","","","","Rio de Janeiro","0","","","","[Produção, DomingoLegal, SantaMaria]","-1","LuizHalann","","","","2013-01-27T16:46:17.000Z","","",""
"95","201","Pedro Santana","<a href=""http://twitter.com"" rel=""nofollow"">Twitter Web Client</a>","false","295573693273366531","1070928944","2013-01-08T13:30:18.000Z","Sou aquela que te encanta e aquela que te enloquece!","","245 novas estrelas brilharão no céu hoje a noite.#TODOSDesejamForçasASantaMaria #SantaMaria #ForçaSantaMaria #prayforsantamaria","","","pt","pt","false","[457126860]","","26821","https://t.co/nqCNTGzvra","true","false","false","206","false","","22","false","","29","Campinas SP","","","3","-1","","","pqpeedro","[TODOSDesejamForçasASantaMaria, SantaMaria, ForçaSantaMaria, prayforsantamaria]","","2013-01-27T16:47:14.000Z","false","","","","false","43466","8429","false","295574595212288001","Elaine Novais","457126860","<a href=""https://about.twitter.com/products/tweetdeck"" rel=""nofollow"">TweetDeck</a>","2012-01-07T02:02:53.000Z","","21, Desenvolvedor web e iOS | Enjoy the silence.","","245 novas estrelas brilharão no céu hoje a noite.#TODOSDesejamForçasASantaMaria #SantaMaria #ForçaSantaMaria #prayforsantamaria","pt","","RT @pqpeedro: 245 novas estrelas brilharão no céu hoje a noite.#TODOSDesejamForçasASantaMaria #SantaMaria #ForçaSantaMaria #prayforsanta ...","false","pt","","3075","","false","false","206","false","false","","0","","false","","3763","","0","","","","[TODOSDesejamForçasASantaMaria, SantaMaria, ForçaSantaMaria]","-1","ElaineNovais4","","false","","2013-01-27T16:50:49.000Z","","[pqpeedro]","false"
"2789","1271","","","","","854978390","2012-09-30T16:32:45.000Z","Entertainment News | Gossip| Event | Fashion |Hypes| Models| Adverts|Contact: For Social Events Coverage/ Track PR MagnusEnt.magazine@gmail.com Add pin:MAYORLAW","","At least 220 killed in Brazil nightclub fire: At least 220 people have died in a fire that swept through a night... http://t.co/vQWfw17R","","","","en","","","","","","","","false","0","false","","","false","","41","","","","","","","","","","","","false","","","","false","","","false","295566382748299264","MAGNUS ENT MAGAZINE","","<a href=""http://twitterfeed.com"" rel=""nofollow"">twitterfeed</a>","","","","","","en","","","false","","","220605","http://t.co/0NgcOEo4GJ","true","false","","","","","71","[http://bit.ly/Vd52GI]","","","","Nigeria +2348038256044","0","","","","","-1","MagnusEnt_Mag","","","","2013-01-27T16:18:11.000Z","","",""
"395","559","","","","","54721315","2009-07-07T23:34:08.000Z","Graduanda em Engenharia de Produção
Alumni Member na AIESEC Campina Grande","","Minha solidariedade a #SantaMaria e a todos os Gaúchos.","","","","pt","","","","","","","","false","1","false","","","false","","36","","","","","","","","","","","","false","","","","false","","","false","295566416294342656","Mirelle Sampaio","","<a href=""http://twitter.com"" rel=""nofollow"">Twitter Web Client</a>","","","","","","pt","","","false","","","1742","http://t.co/NvsOF8bLqu","true","false","","","","","2","","","","","Paraíba, Brasil","0","","","","[SantaMaria]","-1","EngMirelle","","","","2013-01-27T16:18:19.000Z","","",""
"1027","906","","","","","423537534","2011-11-28T16:44:55.000Z","Welcome to #TeamDannyWood ..dedicated to the great artist @dannywood ♥Daniel William Wood Jr, is a singer, songwriter, record producer, actor & a great father ♥","","My solidarity to Brazil, Rio Grande do Sul by the tragedy of 245 students and friends killed in a nightclub. #PrayForSantaMaria","","","","en","","","","","","","","false","5","false","","","false","","474","","","","","","","","","","","","false","","","","false","","","false","295561303437762560","Team Danny Wood","","<a href=""http://twitter.com"" rel=""nofollow"">Twitter Web Client</a>","","","","","","en","","","false","","","11770","","false","false","","","","","14","","","","","","2","","","","[PrayForSantaMaria]","-1","TeamDannyWood","","","","2013-01-27T15:58:00.000Z","","",""
"1278","941","Gabriele Rodrigues","<a href=""http://blackberry.com/twitter"" rel=""nofollow"">Twitter for BlackBerry®</a>","false","295559391279726594","405964070","2011-11-06T02:07:22.000Z","i am demi.louvato from instagram","","#PrayForBrazil ai você percebe q os outros paises se preocupam mais do q os brasileiros","","","pt","pt","false","","","67898","https://t.co/xCZh0iu4kc","false","false","false","21","false","","4","false","","265","Maringá, Brasil","","","0","-1","","","gabisroodrigues","[PrayForBrazil]","","2013-01-27T15:50:24.000Z","false","","","","false","1283","915","false","295559772508393472","mari","449880857","<a href=""http://twitter.com/download/iphone"" rel=""nofollow"">Twitter for iPhone</a>","2011-12-29T16:18:04.000Z","","20, Estudante de Direito ⚖","","#PrayForBrazil ai você percebe q os outros paises se preocupam mais do q os brasileiros","en","","RT @CandyOfMiley: #PrayForBrazil ai você percebe q os outros paises se preocupam mais do q os brasileiros","false","pt","","92881","https://t.co/KEcHsgbubB","true","false","21","false","false","","6","","false","","228","• Kevin RTed me • ","0","","","","[PrayForBrazil]","-1","rockddll","","false","","2013-01-27T15:51:55.000Z","","","false"
