"twitter.user/followersCount","twitter.user/friendsCount","retweet.twitter.user/name","retweet.twitter.tweet/source","retweet.twitter.tweet/favourited","retweet.twitter.tweet/id","twitter.user/id","twitter.user/createdAt","twitter.user/description","twitter.tweet/latitude","twitter.tweet/text","twitter.tweet/inReplyToStatusID","retweet.twitter.tweet/originalText","retweet.twitter.user/lang","twitter.tweet/lang","retweet.twitter.tweet/truncated","twitter.tweet/mentionIds","twitter.tweet/longitude","retweet.twitter.user/statusesCount","retweet.twitter.user/url","retweet.twitter.user/geoEnabled","retweet.twitter.user/protectedTweets","twitter.tweet/possiblySensitive","twitter.tweet/retweetCount","twitter.tweet/isQuote","twitter.tweet/placeName","retweet.twitter.user/listedCount","twitter.user/isTranslator","retweet.twitter.tweet/urls","twitter.user/favouritesCount","retweet.twitter.user/location","twitter.tweet/mediaTypes","retweet.twitter.tweet/inReplyToUserID","retweet.twitter.tweet/favouriteCount","retweet.twitter.user/utcOffset","retweet.twitter.tweet/place","twitter.tweet/inReplyToScreenName","retweet.twitter.user/screenName","retweet.twitter.tweet/hashtags","retweet.twitter.tweet/mediaUrls","retweet.twitter.tweet/created","twitter.user/verified","twitter.tweet/contributors","retweet.twitter.tweet/mentions","retweet.twitter.user/timezone","twitter.user/contributorsEnabled","retweet.twitter.user/followersCount","retweet.twitter.user/friendsCount","twitter.tweet/favourited","twitter.tweet/id","twitter.user/name","retweet.twitter.user/id","twitter.tweet/source","retweet.twitter.user/createdAt","retweet.twitter.tweet/latitude","retweet.twitter.user/description","retweet.twitter.tweet/inReplyToStatusID","retweet.twitter.tweet/text","twitter.user/lang","retweet.twitter.tweet/mentionIds","twitter.tweet/originalText","twitter.tweet/truncated","retweet.twitter.tweet/lang","retweet.twitter.tweet/longitude","twitter.user/statusesCount","twitter.user/url","twitter.user/geoEnabled","twitter.user/protectedTweets","retweet.twitter.tweet/retweetCount","retweet.twitter.tweet/possiblySensitive","retweet.twitter.tweet/isQuote","retweet.twitter.tweet/placeName","twitter.user/listedCount","twitter.tweet/urls","retweet.twitter.user/isTranslator","retweet.twitter.tweet/mediaTypes","retweet.twitter.user/favouritesCount","twitter.user/location","twitter.tweet/favouriteCount","twitter.tweet/inReplyToUserID","twitter.tweet/place","retweet.twitter.tweet/inReplyToScreenName","twitter.tweet/hashtags","twitter.user/utcOffset","twitter.user/screenName","retweet.twitter.tweet/contributors","retweet.twitter.user/verified","twitter.tweet/mediaUrls","twitter.tweet/created","twitter.user/timezone","twitter.tweet/mentions","retweet.twitter.user/contributorsEnabled"
"590","894","Mannes2Society","<a href=""http://twitter.com/#!/download/ipad"" rel=""nofollow"">Twitter for iPad</a>","false","323879298987589632","70641077","2009-09-01T09:34:57.000Z","My DNA put paid to becoming a jockey.","","This pic sure doesn't look good - “@thedailybeast: aftermath of the Boston Marathon bombing (via @brm90) http://t.co/jKO2ogjyQR”","","","en","en","false","[235157198, 16012783, 18142983]","","18815","https://t.co/XJRm6nkloo","false","false","false","49","false","","81","false","[https://twitter.com/thedailybeast/status/323878971991285760/photo/1]","1411","","","16012783","4","-1","","","awmannes","","","2013-04-15T19:23:36.000Z","false","","[thedailybeast, brm90]","","false","808","1362","false","323880602321448961","Nigel","235157198","<a href=""http://tapbots.com/tweetbot"" rel=""nofollow"">Tweetbot for iOS</a>","2011-01-07T14:07:55.000Z","","Come for the vice presidents (my PhD topic) and the robots, stay for the bureaucratic politics and whimsy. Eclectic tweets represent my opinion ONLY!!","323878971991285760","This pic sure doesn't look good - “@thedailybeast: aftermath of the Boston Marathon bombing (via @brm90) http://t.co/jKO2ogjyQR”","en","[16012783, 18142983]","RT @awmannes: This pic sure doesn't look good - “@thedailybeast: aftermath of the Boston Marathon bombing (via @brm90) http://t.co/jKO2o ...","false","en","","27173","","true","false","49","false","false","","32","","false","","14822","HQ. ","0","","","thedailybeast","","-1","nigelgutgenug","","false","","2013-04-15T19:28:47.000Z","","[awmannes, thedailybeast, brm90]","false"
"2551","1127","Rob Gronkowski","<a href=""http://twitter.com/download/iphone"" rel=""nofollow"">Twitter for iPhone</a>","false","323875597191356416","1265709908","2013-03-13T23:31:05.000Z","PLAYOFF SUPERHERO ........alleged Parody","","Wow can't believe what just happened at the Boston Marathon. Praying for everyone down there.","","","en","en","false","[135249573]","","3703","http://t.co/1Ta6yExbgg","false","false","false","1810","false","","5339","false","","5459","","","","497","-1","","","RobGronkowski","","","2013-04-15T19:08:54.000Z","false","","","","false","2997952","417","false","323877624382373888","Danny Payoff Amendola","135249573","<a href=""http://twitter.com/download/iphone"" rel=""nofollow"">Twitter for iPhone</a>","2010-04-20T19:27:19.000Z","","New England Patriots Tight End","","Wow can't believe what just happened at the Boston Marathon. Praying for everyone down there.","en","","RT @RobGronkowski: Wow can't believe what just happened at the Boston Marathon. Praying for everyone down there.","false","en","","10948","","false","false","1810","false","false","","14","","false","","369","Hell ","0","","","","","-1","DouchyAmendola","","true","","2013-04-15T19:16:57.000Z","","[RobGronkowski]","false"
"813","536","","","","","220046832","2010-11-26T16:39:38.000Z","Coach Behandelsystemen ASVZ - Auteur: Triple-C Het gewone leven ervaren - Bricolage - Menswaardigheid als traditie voor mens- & organisatieontwikkeling","","NOS 21.10 Bij de finish van de marathon van Boston hebben zich twee explosies voorgedaan. De eerste berichten spreken van meerdere gewonden.","","","","nl","","","","","","","","false","0","false","","","false","","167","","","","","","","","","","","","false","","","","false","","","false","323877448204836864","Dick van de Weerd","","<a href=""http://twitter.com"" rel=""nofollow"">Twitter Web Client</a>","","","","","","nl","","","false","","","4919","https://t.co/v8kYAeTtkM","true","false","","","","","5","","","","","Amersfoort - Netherlands","0","","","","","-1","MethoDiccck","","","","2013-04-15T19:16:15.000Z","","",""
"221","538","","","","","17015039","2008-10-28T04:00:50.000Z","@Stringbean18, photography, music, art, friends, and family.","","O.O Oh no! :( RT @alicegoldfuss: Explosions at the Boston Marathon. Warning: blood. https://t.co/p9Yn9mknIT (via @theoriginalwak)","","","","en","","[163154809, 3974660176]","","","","","","false","0","false","","","false","","62","","[photo]","","","","","","","","","","false","","","","false","","","false","323877544694784000","hannahindie","","<a href=""http://www.echofon.com/"" rel=""nofollow"">Echofon</a>","","","","","","en","","","false","","","17378","","true","false","","","","","9","","","","","Huntington, WV","0","","","","","-1","hannahindie","","","[http://pbs.twimg.com/media/BH6fwFvCUAA-PWb.jpg]","2013-04-15T19:16:38.000Z","","[alicegoldfuss, theoriginalwak]",""
"1221","1186","","","","","25300573","2009-03-19T14:10:01.000Z","#@","","Vice President just described on CNN a bombing not an explosion #Boston","","","","en","","","","","","","","false","0","false","","","false","","17254","","","","","","","","","","","","false","","","","false","","","false","323888198226956289","DAYO","","<a href=""http://twitter.com/download/iphone"" rel=""nofollow"">Twitter for iPhone</a>","","","","","","en","","","false","","","63735","","true","false","","","","","17","","","","","Drogheda","0","","","","[Boston]","-1","DamianConnor","","","","2013-04-15T19:58:58.000Z","","",""
"1484","609","CNN Breaking News","<a href=""http://twitter.com"" rel=""nofollow"">Twitter Web Client</a>","false","323884478953033728","220741151","2010-11-28T18:11:02.000Z","I'm One With The Force. 
The Force Is With Me.","","New York City has tightened security in wake of explosions at #Boston Marathon. We don't know extent of casualties. http://t.co/rCfe7P4JyR","","","en","en","false","[428333]","","61489","http://t.co/HjKR4r61U5","false","false","false","2239","false","","182101","false","[http://on.cnn.com/YXVW3Y]","384","Everywhere","","","144","-1","","","cnnbrk","[Boston]","","2013-04-15T19:44:11.000Z","false","","","","false","54997055","121","false","323887153811705858","Robi","428333","<a href=""https://chrome.google.com/extensions/detail/encaiiljifbdbjlphpgpiimidegddhic"" rel=""nofollow"">Silver Bird</a>","2007-01-02T01:48:14.000Z","","Breaking news from CNN Digital. Now 55M strong. Check @cnn for all things CNN, breaking and more. Download the app for custom alerts: https://t.co/QFUAuNnQyS","","New York City has tightened security in wake of explosions at #Boston Marathon. We don't know extent of casualties. http://t.co/rCfe7P4JyR","en","","RT @cnnbrk: New York City has tightened security in wake of explosions at #Boston Marathon. We don't know extent of casualties. http://t ...","false","en","","236186","","true","false","2239","false","false","","94","","false","","19","Sardinia, Italy","0","","","","[Boston]","-1","PhoneutriaFera","","true","","2013-04-15T19:54:49.000Z","","[cnnbrk]","false"
"621","664","Matt @ ChefConf 👨‍🍳","<a href=""https://tapbots.com/software/tweetbot/mac"" rel=""nofollow"">Tweetbot for Mac</a>","false","323878474962071553","121483860","2010-03-09T16:57:07.000Z","I make things and build stuff. @CloudFoundry at @pivotal","","All those concerned for loved ones in the #BostonMarathon - you can see where they last checked in here: http://t.co/gQT2IQVsqQ","","","en","en","false","[822520955675123712]","","36880","https://t.co/aD7rmDGtrl","true","false","false","2738","false","","313","false","[http://raceday.baa.org/individual.html]","3267","Portland, OR","","","76","-1","","","mbbroberg","[BostonMarathon]","","2013-04-15T19:20:20.000Z","false","","","","false","4812","1335","false","323879973188419584","Brian McClain","177788470","<a href=""https://tapbots.com/software/tweetbot/mac"" rel=""nofollow"">Tweetbot for Mac</a>","2010-08-13T02:05:50.000Z","","VP Community @Sensu. Contributor to humane communities, open source projects & transparent startups. @Geek_Whisperer alum.","","All those concerned for loved ones in the #BostonMarathon - you can see where they last checked in here: http://t.co/gQT2IQVsqQ","en","","RT @mjbrender: All those concerned for loved ones in the #BostonMarathon - you can see where they last checked in here: http://t.co/gQT2 ...","false","en","","7405","https://t.co/bEQCL2dPMM","true","false","2738","false","false","","27","","false","","3676","Ohio","0","","","","[BostonMarathon]","-1","BrianMMcClain","","false","","2013-04-15T19:26:17.000Z","","[mjbrender]","false"
"192","114","SportsCenter","<a href=""http://twitter.com"" rel=""nofollow"">Twitter Web Client</a>","false","323876747361800192","117558411","2010-02-25T22:47:56.000Z","Love Yourz. Birds Are World Champs '18 #Dreamville","","BREAKING: Authorities are investigating a report of two explosions at the finish line of the Boston Marathon.","","","en","en","false","[26257166]","","103224","https://t.co/RqqkIx8GI7","true","false","false","5644","false","","44736","false","","2870","","","","436","-1","","","SportsCenter","","","2013-04-15T19:13:28.000Z","false","","","","false","35761472","1661","false","323884519788789760","Miles Davis","26257166","<a href=""http://twitter.com/download/iphone"" rel=""nofollow"">Twitter for iPhone</a>","2009-03-24T15:28:02.000Z","","Download the ESPN App ⬇️","","BREAKING: Authorities are investigating a report of two explosions at the finish line of the Boston Marathon.","en","","RT @SportsCenter: BREAKING: Authorities are investigating a report of two explosions at the finish line of the Boston Marathon.","false","en","","14414","","false","false","5644","false","false","","2","","false","","1139","Dying","0","","","","","-1","BigSmoose","","true","","2013-04-15T19:44:21.000Z","","[SportsCenter]","false"
"294","11","KCRG","<a href=""https://about.twitter.com/products/tweetdeck"" rel=""nofollow"">TweetDeck</a>","false","323885609217314816","16688556","2008-10-10T20:19:52.000Z","radio imaginator. momator. voice actor.","","ABC News is reporting that air quality experts have been brought into Boston to ensure explosions were not a chemical attack.","","","en","en","false","[14849086]","","102483","https://t.co/u0smaKAAD4","true","false","false","6","false","","894","false","","3","Cedar Rapids, Iowa","","","0","-1","","","KCRG","","","2013-04-15T19:48:41.000Z","false","","","","false","93213","1050","false","323887460008468480","Mo Holland","14849086","<a href=""http://twitter.com/download/iphone"" rel=""nofollow"">Twitter for iPhone</a>","2008-05-20T21:39:56.000Z","","Your 24-hour news source, covering Cedar Rapids, Dubuque, Iowa City, Waterloo, and points in between. Account managed by KCRG-TV9 news staff.","","ABC News is reporting that air quality experts have been brought into Boston to ensure explosions were not a chemical attack.","en","","RT @KCRG: ABC News is reporting that air quality experts have been brought into Boston to ensure explosions were not a chemical attack.","false","en","","272","https://t.co/XAHjj3Do9r","false","false","6","false","false","","0","","false","","2202","Cedar Rapids, Iowa","0","","","","","-1","moholland1029","","true","","2013-04-15T19:56:02.000Z","","[KCRG]","false"
"10596","1925","","","","","112521835","2010-02-08T20:17:37.000Z","La branche québécoise de Sony Music Entertainment sur Twitter | Snapchat: sonymusiccanada | Instagram: sony_music_canada","","Nos pensées sont avec ceux présents au #bostonmarathon et leurs familles.","","","","fr","","","","","","","","false","3","false","","","false","","1264","","","","","","","","","","","","true","","","","false","","","false","323891750764695552","Sony Music Québec","","<a href=""http://www.hootsuite.com"" rel=""nofollow"">Hootsuite</a>","","","","","","en","","","false","","","12626","https://t.co/DOxeMZfQwy","true","false","","","","","131","","","","","Montréal, Canada","2","","","","[bostonmarathon]","-1","SonyMusicQc","","","","2013-04-15T20:13:05.000Z","","",""
"2014","1053","","","","","402437314","2011-11-01T02:19:14.000Z","🇲🇽🇺🇸","","#PrayForBoston.. this is so sad.. :( my prayers are with all of them","","","","en","","","","","","","","false","0","false","","","false","","4391","","","","","","","","","","","","false","","","","false","","","false","323886050709737472","Jasmin 💜","","<a href=""https://mobile.twitter.com"" rel=""nofollow"">Twitter Lite</a>","","","","","","en","","","false","","","87015","","true","false","","","","","26","","","","","PNW","0","","","","[PrayForBoston]","-1","HxrrySyndrome","","","","2013-04-15T19:50:26.000Z","","",""
"270","481","Mark Weaver","<a href=""http://twitter.com"" rel=""nofollow"">Twitter Web Client</a>","false","323877281196027904","234654226","2011-01-06T06:30:27.000Z","dream out loud","","Live updates of the Boston Marathon bomb http://t.co/FkNJHdSHZC","","","en","en","false","[15170467]","","6106","https://t.co/kgTlhu55nA","true","false","false","15","false","","763","false","[http://livewire.wcvb.com/Event/117th_Running_of_Boston_Marathon]","4074","New York","","","0","-1","","","markweaver","","","2013-04-15T19:15:35.000Z","false","","","","false","13166","460","false","323880648479748096","Jessi Style","15170467","<a href=""http://twitter.com/download/iphone"" rel=""nofollow"">Twitter for iPhone</a>","2008-06-19T16:10:49.000Z","","","","Live updates of the Boston Marathon bomb http://t.co/FkNJHdSHZC","en","","RT @markweaver: Live updates of the Boston Marathon bomb http://t.co/FkNJHdSHZC","false","en","","21526","","false","false","15","false","false","","1","[http://livewire.wcvb.com/Event/117th_Running_of_Boston_Marathon]","false","","6017","","0","","","","","-1","stylejessi","","true","","2013-04-15T19:28:58.000Z","","[markweaver]","false"
"285","389","Cocoa Unicorn 🍫🦄","<a href=""http://www.myplume.com/"" rel=""nofollow"">Plume for Android</a>","false","323888166132125696","35907750","2009-04-27T23:40:36.000Z","UNCG Alum C/O 2013 #bullcity http://t.co/F8HScWRb1Z","","Ok so about these explosions in Boston?!","","","en","en","false","[224262665]","","7300","https://t.co/oTnqbrxJA2","false","false","false","1","false","","3","false","","20","Charlotte, NC","","","0","-1","","","DapDMoney","","","2013-04-15T19:58:51.000Z","false","","","","false","360","366","false","323888353391042561","Darien Smith","224262665","<a href=""http://twitter.com/download/iphone"" rel=""nofollow"">Twitter for iPhone</a>","2010-12-08T15:25:15.000Z","","Graphic Designer covered in ✨Glitter✨

IG: dapdesignz","","Ok so about these explosions in Boston?!","en","","RT @DapDMoney: Ok so about these explosions in Boston?!","false","en","","21460","","true","false","1","false","false","","3","","false","","261","Earth (for now)","0","","","","","-1","i_Serv_Shotguns","","false","","2013-04-15T19:59:35.000Z","","[DapDMoney]","false"
"722","280","","","","","184178184","2010-08-28T22:15:48.000Z","July........ please be good to me!!! 😇 #7/7 #travelbug #single #lovernotafighter #blessed #fukboifree 🙌🏽🙌🏽","","I hope everyone in Boston is ok and I'm gonna pray for all the marathon runners.","","","","en","","","","","","","","false","0","false","","","false","","4367","","","","","","","","","","","","false","","","","false","","","false","323880044462219264","Heather","","<a href=""http://twitter.com"" rel=""nofollow"">Twitter Web Client</a>","","","","","","en","","","false","","","93061","","false","false","","","","","25","","","","","USA","0","","","","","-1","heyheather85","","","","2013-04-15T19:26:34.000Z","","",""
"258","139","","","","","198436070","2010-10-04T09:14:52.000Z","I like to live :) Intrested in design, psychology, reading, girlfriend and cats... and many many other things","","People injured in explosions near Boston Marathon finish line: Two explosions at the finish line of the Boston... http://t.co/h3iaFxQv6D","","","","en","","","","","","","","false","0","false","","","false","","1","","","","","","","","","","","","false","","","","false","","","false","323879553741234176","Tanya Pervakova","","<a href=""http://twitterfeed.com"" rel=""nofollow"">twitterfeed</a>","","","","","","en","","","false","","","13185","http://t.co/jqcYIGScHS","false","false","","","","","1","[http://bit.ly/105K6Yt]","","","","Ukraine","0","","","","","-1","ThisSmileyWorld","","","","2013-04-15T19:24:37.000Z","","",""
"951","1869","Marissa Sifuentes","<a href=""https://about.twitter.com/products/tweetdeck"" rel=""nofollow"">TweetDeck</a>","false","323886593263951872","30715888","2009-04-12T20:33:42.000Z","Proud Author of K9 Heroes, Avid Safari Live viewer, and Super Fan of The Slow Drag  https://t.co/CWlI8gIASP","","#BREAKING #BOSTONMARATHON former LAPD Chief William Bratton live on NBC News right now said one of his sources estimates 50 injuries","","","en","en","false","[348630591]","","1623","","true","false","false","21","false","","54","false","","1681","Los Angeles","","","0","-1","","","MarissaNBCLA","[BREAKING, BOSTONMARATHON]","","2013-04-15T19:52:36.000Z","false","","","","false","1102","685","false","323887120261468160","Nicole","348630591","<a href=""http://twitter.com"" rel=""nofollow"">Twitter Web Client</a>","2011-08-04T18:59:24.000Z","","Producer for NBC4, Mother of Olivia & Marlow, Blair's Wife #luckiestgirlintheworld","","#BREAKING #BOSTONMARATHON former LAPD Chief William Bratton live on NBC News right now said one of his sources estimates 50 injuries","en","","RT @MarissaNBCLA: #BREAKING #BOSTONMARATHON former LAPD Chief William Bratton live on NBC News right now said one of his sources estimat ...","false","en","","2854","https://t.co/aUzmNEqNNT","false","false","21","false","false","","13","","false","","52","Northern, CA","0","","","","[BREAKING, BOSTONMARATHON]","-1","Nickycaly","","false","","2013-04-15T19:54:41.000Z","","[MarissaNBCLA]","false"
"829","453","","","","","460589895","2012-01-10T22:38:38.000Z","bsu","","Bombing in Boston?😔","","","","en","","","","","","","","false","0","false","","","false","","11452","","","","","","","","","","","","false","","","","false","","","false","323879075607363585","tyler","","<a href=""http://twitter.com/download/iphone"" rel=""nofollow"">Twitter for iPhone</a>","","","","","","en","","","false","","","8495","","true","false","","","","","1","","","","","","1","","","","","-1","tylerpencee","","","","2013-04-15T19:22:43.000Z","","",""
"255","1017","","","","","414090639","2011-11-16T16:29:59.000Z","Mother,wife&worst witch.Waitressing bookworm.Halloween addicted Pinterest lover.Enjoying a happy,healthy lifestyle in my new body","","Jesus fucking Christ. Those poor people at Boston marathon. I feel sick.","","","","en","","","","","","","","false","0","false","","","false","","309","","","","","","","","","","","","false","","","","false","","","false","323878794576412672","Teresa Sunkes Tague","","<a href=""http://twitter.com/download/iphone"" rel=""nofollow"">Twitter for iPhone</a>","","","","","","en","","","false","","","5671","","true","false","","","","","6","","","","","NY","0","","","","","-1","harvestwitch","","","","2013-04-15T19:21:36.000Z","","",""
"230","403","","","","","39180089","2009-05-11T03:17:00.000Z","Marketing professional, Music Lover, Complete Nerd.","","Thoughts & prayers go out the victims of the Boston Marathon Explosion. So sad :( What's wrong with the world?","","","","en","","","","","","","","false","0","false","","","false","","337","","","","","","","","","","","","false","","","","false","","","false","323882317791756288","jessica lynn","","<a href=""http://twitter.com"" rel=""nofollow"">Twitter Web Client</a>","","","","","","en","","","false","","","7362","","true","false","","","","","20","","","","","New York, NY","0","","","","","-1","jesscinsky","","","","2013-04-15T19:35:36.000Z","","",""
"1480","900","Tim Brannigan","<a href=""http://twitter.com"" rel=""nofollow"">Twitter Web Client</a>","false","323877783069655041","201881524","2010-10-12T20:52:03.000Z","King 👑 • God ☝️ • Ambitious 💰 • 💣💥","","Photo of the bomb actually exploding in the distance at #Boston marathon http://t.co/LA8LhMQVnF","","","en","en","false","[256180339]","","195935","https://t.co/e7MFuZItMs","true","false","true","161","false","","1","false","","297","Belfast, Ireland","[photo]","","10","-1","","","tim_brannigan","[Boston]","[http://pbs.twimg.com/media/BH6lILMCAAEqGSY.jpg]","2013-04-15T19:17:35.000Z","false","","","","false","8305","2425","false","323883827762180097","Itz Me...","256180339","<a href=""http://twitter.com/download/android"" rel=""nofollow"">Twitter for Android</a>","2011-02-22T20:43:03.000Z","","Black/Irish writer. Jailed on IRA guns charges 1990-95. Socialist. LFC. Kissed Beyonce. Memoir 'Where Are You Really From?' optioned for a movie. Honest!","","Photo of the bomb actually exploding in the distance at #Boston marathon http://t.co/LA8LhMQVnF","en","","RT @tim_brannigan: Photo of the bomb actually exploding in the distance at #Boston marathon http://t.co/LA8LhMQVnF","false","en","","13458","","false","false","161","false","false","","38","","false","[photo]","72736","On the Grind....","0","","","","[Boston]","-1","AmbitiousWen","","false","[http://pbs.twimg.com/media/BH6lILMCAAEqGSY.jpg]","2013-04-15T19:41:36.000Z","","[tim_brannigan]","false"
"111","183","The Wall Street Journal","<a href=""http://www.socialflow.com"" rel=""nofollow"">SocialFlow</a>","false","323878779996999681","400516570","2011-10-29T04:57:38.000Z","Interested in natural, organic & healthy nutritional products that actually work","","Follow live coverage of the aftermath of two explosions at the finish line of the Boston Marathon: http://t.co/48ZPPOXJ6I","","","en","en","false","[3108351]","","243875","https://t.co/GhhR6PLfem","true","false","false","176","false","","109247","false","[http://on.wsj.com/116tlcr]","17","New York, NY","","","9","-1","","","WSJ","","","2013-04-15T19:21:33.000Z","false","","","","false","15851786","1112","false","323884742107873280","gix er","3108351","<a href=""http://twitter.com/download/android"" rel=""nofollow"">Twitter for Android</a>","2007-04-01T06:22:13.000Z","","Breaking news and features from the WSJ.","","Follow live coverage of the aftermath of two explosions at the finish line of the Boston Marathon: http://t.co/48ZPPOXJ6I","en-gb","","RT @WSJ: Follow live coverage of the aftermath of two explosions at the finish line of the Boston Marathon: http://t.co/48ZPPOXJ6I","false","en","","1011","https://t.co/1bKk0xbu","false","false","176","false","false","","11","[http://on.wsj.com/116tlcr]","false","","1279","Scotland","0","","","","","-1","gixer3","","true","","2013-04-15T19:45:14.000Z","","[WSJ]","false"
