"3058","2787","Demi Lovato","<a href=""http://twitter.com/download/iphone"" rel=""nofollow"">Twitter for iPhone</a>","false","295715679091429376","454124526","2012-01-03T17:08:09.000Z","","","So sad to hear about the nightclub fire in Brazil. Such a tragedy. Praying for everyone affected down there.","","","en","en","false","[21111883]","","16891","https://t.co/f2jgasvk8i","true","false","false","44586","false","","101490","false","","920","DALLAS/LA","","","18656","-1","","","ddlovato","","","2013-01-28T02:11:26.000Z","false","","","","false","57101788","539","false","295724520600395776","yasmim","21111883","<a href=""http://twitter.com/download/android"" rel=""nofollow"">Twitter for Android</a>","2009-02-17T18:02:08.000Z","","Singer, Songwriter, Actress, Entrepreneur, Philanthropist 💗 Listen to #FallInLine here: https://t.co/f2jgasvk8i","","So sad to hear about the nightclub fire in Brazil. Such a tragedy. Praying for everyone affected down there.","pt","","RT @ddlovato: So sad to hear about the nightclub fire in Brazil. Such a tragedy. Praying for everyone affected down there.","false","en","","119301","","true","false","44586","false","false","","3","","false","","2068","Porto Alegre, Rio Grande do Sul","0","","","","","-1","selenawarie","","true","","2013-01-28T02:46:34.000Z","","[ddlovato]","false"
"2045","1020","Demi Lovato","<a href=""http://twitter.com/download/iphone"" rel=""nofollow"">Twitter for iPhone</a>","false","295715679091429376","98919742","2009-12-23T17:06:33.000Z","linda, safada e doida","","So sad to hear about the nightclub fire in Brazil. Such a tragedy. Praying for everyone affected down there.","","","en","en","false","[21111883]","","16891","https://t.co/f2jgasvk8i","true","false","false","44586","false","","101490","false","","67802","DALLAS/LA","","","18656","-1","","","ddlovato","","","2013-01-28T02:11:26.000Z","false","","","","false","57101788","539","false","295717201548296193","larissão","21111883","<a href=""http://twitter.com"" rel=""nofollow"">Twitter Web Client</a>","2009-02-17T18:02:08.000Z","","Singer, Songwriter, Actress, Entrepreneur, Philanthropist 💗 Listen to #FallInLine here: https://t.co/f2jgasvk8i","","So sad to hear about the nightclub fire in Brazil. Such a tragedy. Praying for everyone affected down there.","pt","","RT @ddlovato: So sad to hear about the nightclub fire in Brazil. Such a tragedy. Praying for everyone affected down there.","false","en","","143813","https://t.co/E8Ma0EcS6e","true","false","44586","false","false","","105","","false","","2068","Fortaleza, Brasil","0","","","","","-1","laristorm","","true","","2013-01-28T02:17:29.000Z","","[ddlovato]","false"
"883","433","Demi Lovato","<a href=""http://twitter.com/download/iphone"" rel=""nofollow"">Twitter for iPhone</a>","false","295715679091429376","623295071","2012-07-01T01:26:08.000Z","cu","","So sad to hear about the nightclub fire in Brazil. Such a tragedy. Praying for everyone affected down there.","","","en","en","false","[21111883]","","16891","https://t.co/f2jgasvk8i","true","false","false","44586","false","","101490","false","","15600","DALLAS/LA","","","18656","-1","","","ddlovato","","","2013-01-28T02:11:26.000Z","false","","","","false","57101788","539","false","295763284341190656","pedrao tristao","21111883","<a href=""http://twitter.com/download/android"" rel=""nofollow"">Twitter for Android</a>","2009-02-17T18:02:08.000Z","","Singer, Songwriter, Actress, Entrepreneur, Philanthropist 💗 Listen to #FallInLine here: https://t.co/f2jgasvk8i","","So sad to hear about the nightclub fire in Brazil. Such a tragedy. Praying for everyone affected down there.","pt","","RT @ddlovato: So sad to hear about the nightclub fire in Brazil. Such a tragedy. Praying for everyone affected down there.","false","en","","37051","","false","false","44586","false","false","","7","","false","","2068","UFRRJ","0","","","","","-1","chorajoe","","true","","2013-01-28T05:20:36.000Z","","[ddlovato]","false"
"419","555","Demi Lovato","<a href=""http://twitter.com/download/iphone"" rel=""nofollow"">Twitter for iPhone</a>","false","295715679091429376","795009720","2012-09-01T00:58:20.000Z","You have bewitched me, body and soul, and I love... I love... I love you. and I never wish to be parted from you - Pride and Prejudice. ♥","","So sad to hear about the nightclub fire in Brazil. Such a tragedy. Praying for everyone affected down there.","","","en","en","false","[21111883]","","16891","https://t.co/f2jgasvk8i","true","false","false","44586","false","","101490","false","","588","DALLAS/LA","","","18656","-1","","","ddlovato","","","2013-01-28T02:11:26.000Z","false","","","","false","57101788","539","false","295733546713223168","Annabeth Queijo","21111883","<a href=""http://twitter.com"" rel=""nofollow"">Twitter Web Client</a>","2009-02-17T18:02:08.000Z","","Singer, Songwriter, Actress, Entrepreneur, Philanthropist 💗 Listen to #FallInLine here: https://t.co/f2jgasvk8i","","So sad to hear about the nightclub fire in Brazil. Such a tragedy. Praying for everyone affected down there.","pt","","RT @ddlovato: So sad to hear about the nightclub fire in Brazil. Such a tragedy. Praying for everyone affected down there.","false","en","","37218","","true","false","44586","false","false","","3","","false","","2068","","0","","","","","-1","cupcakedo_niam","","true","","2013-01-28T03:22:26.000Z","","[ddlovato]","false"
"1993","1946","","","","","38964844","2009-05-10T01:01:41.000Z","Mhario Lincoln é jornalista profissional e autor do livro SEGREDOS POÉTICOS. Editor do site Acervum. https://t.co/57dJ7l4LMO.","","Dono da boate Kiss, de Santa Maria (RS), Elissandro Kiko é réu em processo por lesões corporais graves, na 4ª Vara Criminal da cidade.","","","","pt","","","","","","","","false","0","false","","","false","","4729","","","","","","","","","","","","false","","","","false","","","false","295724189225209857","Mhario Lincoln","","<a href=""https://mobile.twitter.com"" rel=""nofollow"">Twitter Lite</a>","","","","","","pt","","","false","","","67164","https://t.co/Kl1LaccTfZ","true","false","","","","","25","","","","","Curitiba/Brazil","0","","","","","-1","MharioLincoln","","","","2013-01-28T02:45:15.000Z","","",""
"325","265","Demi Lovato","<a href=""http://twitter.com/download/iphone"" rel=""nofollow"">Twitter for iPhone</a>","false","295715679091429376","125369022","2010-03-22T15:49:56.000Z","🌷🌸","","So sad to hear about the nightclub fire in Brazil. Such a tragedy. Praying for everyone affected down there.","","","en","en","false","[21111883]","","16891","https://t.co/f2jgasvk8i","true","false","false","44586","false","","101490","false","","1372","DALLAS/LA","","","18656","-1","","","ddlovato","","","2013-01-28T02:11:26.000Z","false","","","","false","57101788","539","false","295718740824301568","Dani.","21111883","<a href=""http://twitter.com"" rel=""nofollow"">Twitter Web Client</a>","2009-02-17T18:02:08.000Z","","Singer, Songwriter, Actress, Entrepreneur, Philanthropist 💗 Listen to #FallInLine here: https://t.co/f2jgasvk8i","","So sad to hear about the nightclub fire in Brazil. Such a tragedy. Praying for everyone affected down there.","pt","","RT @ddlovato: So sad to hear about the nightclub fire in Brazil. Such a tragedy. Praying for everyone affected down there.","false","en","","17267","https://t.co/0wStYFRue6","true","false","44586","false","false","","12","","false","","2068","Las Vegas, NV","0","","","","","-1","itsdanimorais","","true","","2013-01-28T02:23:36.000Z","","[ddlovato]","false"
"115","121","Demi Lovato","<a href=""http://twitter.com/download/iphone"" rel=""nofollow"">Twitter for iPhone</a>","false","295715679091429376","322815035","2011-06-23T19:54:40.000Z","","","So sad to hear about the nightclub fire in Brazil. Such a tragedy. Praying for everyone affected down there.","","","en","en","false","[21111883]","","16891","https://t.co/f2jgasvk8i","true","false","false","44586","false","","101490","false","","2","DALLAS/LA","","","18656","-1","","","ddlovato","","","2013-01-28T02:11:26.000Z","false","","","","false","57101788","539","false","295719248360267778","Myllena Camargo","21111883","<a href=""https://mobile.twitter.com"" rel=""nofollow"">Mobile Web (M2)</a>","2009-02-17T18:02:08.000Z","","Singer, Songwriter, Actress, Entrepreneur, Philanthropist 💗 Listen to #FallInLine here: https://t.co/f2jgasvk8i","","So sad to hear about the nightclub fire in Brazil. Such a tragedy. Praying for everyone affected down there.","pt","","RT @ddlovato: So sad to hear about the nightclub fire in Brazil. Such a tragedy. Praying for everyone affected down there.","false","en","","7197","","true","false","44586","false","false","","0","","false","","2068","","0","","","","","-1","myllenacam_","","true","","2013-01-28T02:25:37.000Z","","[ddlovato]","false"
"386","589","BBC Breaking News","<a href=""http://www.bbc.co.uk/news/"" rel=""nofollow"">BBC News</a>","false","295700922191970304","336441684","2011-07-16T09:03:28.000Z","I GOT ALL THE 🔥🔥🔥 BEATz. Inquiries: Kruelbeats@gmail.com. 🙏🏽🤟🏽","","Update: At least 233 people have died in a fire at Kiss nightclub in #SantaMaria, #Brazil http://t.co/K5p1pYoS","","","en","en","false","[5402612]","","34430","http://t.co/vBzl7LOaso","false","false","false","1805","false","","132028","false","[http://bbc.in/10X1o42]","3067","London, UK","","","167","-1","","","BBCBreaking","[SantaMaria, Brazil]","","2013-01-28T01:12:48.000Z","false","","","","false","38241772","3","false","295760834871844864","KruelEntentions","5402612","<a href=""http://www.twitter.com"" rel=""nofollow"">Twitter for Windows Phone</a>","2007-04-22T14:42:37.000Z","","Breaking news alerts and updates from the BBC. For news, features, analysis follow @BBCWorld (international) or @BBCNews (UK). Latest sport news @BBCSport.","","Update: At least 233 people have died in a fire at Kiss nightclub in #SantaMaria, #Brazil http://t.co/K5p1pYoS","en","","RT @BBCBreaking: Update: At least 233 people have died in a fire at Kiss nightclub in #SantaMaria, #Brazil http://t.co/K5p1pYoS","false","en","","8081","https://t.co/DCxbprM4B6","true","false","1805","false","false","","0","[http://bbc.in/10X1o42]","false","","0","your 👄","0","","","","[SantaMaria, Brazil]","-1","Kruelententionz","","true","","2013-01-28T05:10:52.000Z","","[BBCBreaking]","false"
"3074","3556","Demi Lovato","<a href=""http://twitter.com/download/iphone"" rel=""nofollow"">Twitter for iPhone</a>","false","295715679091429376","103515213","2010-01-10T08:00:27.000Z","'only know you love her when you let her go.'","","So sad to hear about the nightclub fire in Brazil. Such a tragedy. Praying for everyone affected down there.","","","en","en","false","[21111883]","","16891","https://t.co/f2jgasvk8i","true","false","false","44586","false","","101490","false","","289","DALLAS/LA","","","18656","-1","","","ddlovato","","","2013-01-28T02:11:26.000Z","false","","","","false","57101788","539","false","295776462844358656","ribs.","21111883","<a href=""http://twitter.com/download/android"" rel=""nofollow"">Twitter for Android</a>","2009-02-17T18:02:08.000Z","","Singer, Songwriter, Actress, Entrepreneur, Philanthropist 💗 Listen to #FallInLine here: https://t.co/f2jgasvk8i","","So sad to hear about the nightclub fire in Brazil. Such a tragedy. Praying for everyone affected down there.","en","","RT @ddlovato: So sad to hear about the nightclub fire in Brazil. Such a tragedy. Praying for everyone affected down there.","false","en","","26235","http://t.co/GlMeMeyPc0","false","false","44586","false","false","","9","","false","","2068","220213/230313","0","","","","","-1","cyrusbelly","","true","","2013-01-28T06:12:58.000Z","","[ddlovato]","false"
"3413","442","Demi Lovato","<a href=""http://twitter.com/download/iphone"" rel=""nofollow"">Twitter for iPhone</a>","false","295715679091429376","176148650","2010-08-08T18:23:28.000Z","chama no probleminha bb","","So sad to hear about the nightclub fire in Brazil. Such a tragedy. Praying for everyone affected down there.","","","en","en","false","[21111883]","","16891","https://t.co/f2jgasvk8i","true","false","false","44586","false","","101490","false","","707","DALLAS/LA","","","18656","-1","","","ddlovato","","","2013-01-28T02:11:26.000Z","false","","","","false","57101788","539","false","295716253627203584","Tati","21111883","<a href=""http://twitter.com"" rel=""nofollow"">Twitter Web Client</a>","2009-02-17T18:02:08.000Z","","Singer, Songwriter, Actress, Entrepreneur, Philanthropist 💗 Listen to #FallInLine here: https://t.co/f2jgasvk8i","","So sad to hear about the nightclub fire in Brazil. Such a tragedy. Praying for everyone affected down there.","pt","","RT @ddlovato: So sad to hear about the nightclub fire in Brazil. Such a tragedy. Praying for everyone affected down there.","false","en","","12793","https://t.co/1huX4vD5Sc","true","false","44586","false","false","","81","","false","","2068","","0","","","","","-1","httoriginals","","true","","2013-01-28T02:13:43.000Z","","[ddlovato]","false"
"11","22","","","","","799141159","2012-09-02T22:14:33.000Z","","","Photos: Hundreds dead after Brazil nightclub fire http://t.co/8jGivQsN","","","","en","","","","","","","","false","0","false","","","false","","2","","","","","","","","","","","","false","","","","false","","","false","295766031610298368","Orville Gates","","<a href=""http://www.facebook.com/twitter"" rel=""nofollow"">Facebook</a>","","","","","","en","","","false","","","23021","","false","false","","","","","0","[http://fb.me/1QGv1daey]","","","","","0","","","","","-1","jrgates54","","","","2013-01-28T05:31:31.000Z","","",""
"601","475","Demi Lovato","<a href=""http://twitter.com/download/iphone"" rel=""nofollow"">Twitter for iPhone</a>","false","295715679091429376","37063842","2009-05-01T22:38:18.000Z","20. artist? they/them. army that is Yoongi trash 🤷🏻‍♀️ I’m probably on my third coffee I’m trying to stop. Dabbling in cosplay.","","So sad to hear about the nightclub fire in Brazil. Such a tragedy. Praying for everyone affected down there.","","","en","en","false","[21111883]","","16891","https://t.co/f2jgasvk8i","true","false","false","44586","false","","101490","false","","30978","DALLAS/LA","","","18656","-1","","","ddlovato","","","2013-01-28T02:11:26.000Z","false","","","","false","57101788","539","false","295715926442127361","little kit🖤","21111883","<a href=""http://twitter.com/download/iphone"" rel=""nofollow"">Twitter for iPhone</a>","2009-02-17T18:02:08.000Z","","Singer, Songwriter, Actress, Entrepreneur, Philanthropist 💗 Listen to #FallInLine here: https://t.co/f2jgasvk8i","","So sad to hear about the nightclub fire in Brazil. Such a tragedy. Praying for everyone affected down there.","en","","RT @ddlovato: So sad to hear about the nightclub fire in Brazil. Such a tragedy. Praying for everyone affected down there.","false","en","","29510","https://t.co/NVevLCO0Ai","false","false","44586","false","false","","10","","false","","2068","Jersey","0","","","","","-1","LindsayGCastro","","true","","2013-01-28T02:12:25.000Z","","[ddlovato]","false"
"448","206","Demi Lovato","<a href=""http://twitter.com/download/iphone"" rel=""nofollow"">Twitter for iPhone</a>","false","295715679091429376","462287888","2012-01-12T19:53:29.000Z","fuck everyone","","So sad to hear about the nightclub fire in Brazil. Such a tragedy. Praying for everyone affected down there.","","","en","en","false","[21111883]","","16891","https://t.co/f2jgasvk8i","true","false","false","44586","false","","101490","false","","70","DALLAS/LA","","","18656","-1","","","ddlovato","","","2013-01-28T02:11:26.000Z","false","","","","false","57101788","539","false","295746280624369664","gabi","21111883","<a href=""http://twitter.com/download/iphone"" rel=""nofollow"">Twitter for iPhone</a>","2009-02-17T18:02:08.000Z","","Singer, Songwriter, Actress, Entrepreneur, Philanthropist 💗 Listen to #FallInLine here: https://t.co/f2jgasvk8i","","So sad to hear about the nightclub fire in Brazil. Such a tragedy. Praying for everyone affected down there.","en","","RT @ddlovato: So sad to hear about the nightclub fire in Brazil. Such a tragedy. Praying for everyone affected down there.","false","en","","34285","","false","false","44586","false","false","","2","","false","","2068","Brazil","0","","","","","-1","hereforkristen","","true","","2013-01-28T04:13:02.000Z","","[ddlovato]","false"
"845","1300","Demi Lovato","<a href=""http://twitter.com/download/iphone"" rel=""nofollow"">Twitter for iPhone</a>","false","295715679091429376","1050392545","2012-12-31T13:55:52.000Z","Arquivo o que penso e isso é tudo que você precisa saber☼Blog ↓","","So sad to hear about the nightclub fire in Brazil. Such a tragedy. Praying for everyone affected down there.","","","en","en","false","[21111883]","","16891","https://t.co/f2jgasvk8i","true","false","false","44586","false","","101490","false","","1212","DALLAS/LA","","","18656","-1","","","ddlovato","","","2013-01-28T02:11:26.000Z","false","","","","false","57101788","539","false","295726282199678976","Letícia S.","21111883","<a href=""http://twitter.com"" rel=""nofollow"">Twitter Web Client</a>","2009-02-17T18:02:08.000Z","","Singer, Songwriter, Actress, Entrepreneur, Philanthropist 💗 Listen to #FallInLine here: https://t.co/f2jgasvk8i","","So sad to hear about the nightclub fire in Brazil. Such a tragedy. Praying for everyone affected down there.","pt","","RT @ddlovato: So sad to hear about the nightclub fire in Brazil. Such a tragedy. Praying for everyone affected down there.","false","en","","7461","https://t.co/9ufmigfIfI","false","false","44586","false","false","","2","","false","","2068","Rio De Janeiro","0","","","","","-1","GarotadoArquivo","","true","","2013-01-28T02:53:34.000Z","","[ddlovato]","false"
"4173","2491","Demi Lovato","<a href=""http://twitter.com/download/iphone"" rel=""nofollow"">Twitter for iPhone</a>","false","295715679091429376","130152701","2010-04-06T13:31:19.000Z","18 YO, Paulistano tipo exportação. Gente fina - mais fino do que gente. Menos futil do que parece e tem o problema de ter mais bom gosto do que dinheiro.","","So sad to hear about the nightclub fire in Brazil. Such a tragedy. Praying for everyone affected down there.","","","en","en","false","[21111883]","","16891","https://t.co/f2jgasvk8i","true","false","false","44586","false","","101490","false","","219","DALLAS/LA","","","18656","-1","","","ddlovato","","","2013-01-28T02:11:26.000Z","false","","","","false","57101788","539","false","295773392618000384","Saint Pablo","21111883","<a href=""https://mobile.twitter.com"" rel=""nofollow"">Mobile Web (M2)</a>","2009-02-17T18:02:08.000Z","","Singer, Songwriter, Actress, Entrepreneur, Philanthropist 💗 Listen to #FallInLine here: https://t.co/f2jgasvk8i","","So sad to hear about the nightclub fire in Brazil. Such a tragedy. Praying for everyone affected down there.","pt","","RT @ddlovato: So sad to hear about the nightclub fire in Brazil. Such a tragedy. Praying for everyone affected down there.","false","en","","62030","http://www.facebook.com/iam.beyoncediva","true","false","44586","false","false","","5","","false","","2068","São Paulo, SP. / Cajamar, SP.","0","","","","","-1","knowles_real","","true","","2013-01-28T06:00:46.000Z","","[ddlovato]","false"
"1529","1834","Demi Lovato","<a href=""http://twitter.com/download/iphone"" rel=""nofollow"">Twitter for iPhone</a>","false","295715679091429376","1059505986","2013-01-04T04:17:47.000Z","Greenberg, put your hand down, you don't have a chance","","So sad to hear about the nightclub fire in Brazil. Such a tragedy. Praying for everyone affected down there.","","","en","en","false","[21111883]","","16891","https://t.co/f2jgasvk8i","true","false","false","44586","false","","101490","false","","353","DALLAS/LA","","","18656","-1","","","ddlovato","","","2013-01-28T02:11:26.000Z","false","","","","false","57101788","539","false","295716211659010049","duda","21111883","<a href=""http://twitter.com"" rel=""nofollow"">Twitter Web Client</a>","2009-02-17T18:02:08.000Z","","Singer, Songwriter, Actress, Entrepreneur, Philanthropist 💗 Listen to #FallInLine here: https://t.co/f2jgasvk8i","","So sad to hear about the nightclub fire in Brazil. Such a tragedy. Praying for everyone affected down there.","pt","","RT @ddlovato: So sad to hear about the nightclub fire in Brazil. Such a tragedy. Praying for everyone affected down there.","false","en","","37258","","true","false","44586","false","false","","4","","false","","2068","03/11/13","0","","","","","-1","onceollg","","true","","2013-01-28T02:13:33.000Z","","[ddlovato]","false"
"410","2195","Demi Lovato","<a href=""http://twitter.com/download/iphone"" rel=""nofollow"">Twitter for iPhone</a>","false","295715679091429376","48732049","2009-06-19T15:18:13.000Z","Na incerterza de obter resultados alegres, tento aprender o sentido desta vida que depende de mim para ser o que ela é de verdade","","So sad to hear about the nightclub fire in Brazil. Such a tragedy. Praying for everyone affected down there.","","","en","en","false","[21111883]","","16891","https://t.co/f2jgasvk8i","true","false","false","44586","false","","101490","false","","6296","DALLAS/LA","","","18656","-1","","","ddlovato","","","2013-01-28T02:11:26.000Z","false","","","","false","57101788","539","false","295716295574421505","Bruna Lisiê ","21111883","<a href=""http://twitter.com"" rel=""nofollow"">Twitter Web Client</a>","2009-02-17T18:02:08.000Z","","Singer, Songwriter, Actress, Entrepreneur, Philanthropist 💗 Listen to #FallInLine here: https://t.co/f2jgasvk8i","","So sad to hear about the nightclub fire in Brazil. Such a tragedy. Praying for everyone affected down there.","pt","","RT @ddlovato: So sad to hear about the nightclub fire in Brazil. Such a tragedy. Praying for everyone affected down there.","false","en","","18371","http://t.co/xCaRliUb6q","true","false","44586","false","false","","9","","false","","2068","","0","","","","","-1","brunalisie","","true","","2013-01-28T02:13:53.000Z","","[ddlovato]","false"
"1063","1109","Demi Lovato","<a href=""http://twitter.com/download/iphone"" rel=""nofollow"">Twitter for iPhone</a>","false","295715679091429376","224285438","2010-12-08T16:30:08.000Z","Lost in my thoughts. 


I'm in love with Jackson Wang 🙃","","So sad to hear about the nightclub fire in Brazil. Such a tragedy. Praying for everyone affected down there.","","","en","en","false","[21111883]","","16891","https://t.co/f2jgasvk8i","true","false","false","44586","false","","101490","false","","10130","DALLAS/LA","","","18656","-1","","","ddlovato","","","2013-01-28T02:11:26.000Z","false","","","","false","57101788","539","false","295725871174672385","Deysait","21111883","<a href=""http://twitter.com/download/android"" rel=""nofollow"">Twitter for Android</a>","2009-02-17T18:02:08.000Z","","Singer, Songwriter, Actress, Entrepreneur, Philanthropist 💗 Listen to #FallInLine here: https://t.co/f2jgasvk8i","","So sad to hear about the nightclub fire in Brazil. Such a tragedy. Praying for everyone affected down there.","es","","RT @ddlovato: So sad to hear about the nightclub fire in Brazil. Such a tragedy. Praying for everyone affected down there.","false","en","","8347","https://t.co/rvIzQr78DP","false","false","44586","false","false","","1","","false","","2068","Jupiter","0","","","","","-1","Hipofisis","","true","","2013-01-28T02:51:56.000Z","","[ddlovato]","false"
"14785","701","Steph.","<a href=""http://blackberry.com/twitter"" rel=""nofollow"">Twitter for BlackBerry®</a>","false","295737596464738304","952975032","2012-11-17T05:30:01.000Z","lucylawless • xena | mm, lh, ses, cp.","","Dios llene de fuerza a cada una de las familias que hoy se encuentran de luto en el país hermano, #PrayForBrazil #PrayForSantaMaria.","","","es","es","false","[180996000]","","84903","","true","false","false","2","false","","0","true","","362","","","","0","-1","","","StephaniaSarco","[PrayForBrazil, PrayForSantaMaria]","","2013-01-28T03:38:32.000Z","false","","","","false","574","229","false","295737837490405377","Nay 🅾 +","180996000","<a href=""http://twitter.com"" rel=""nofollow"">Twitter Web Client</a>","2010-08-21T01:02:46.000Z","","","","Dios llene de fuerza a cada una de las familias que hoy se encuentran de luto en el país hermano, #PrayForBrazil #PrayForSantaMaria.","pt","","RT @StephaniaSarco: Dios llene de fuerza a cada una de las familias que hoy se encuentran de luto en el país hermano, #PrayForBrazil #Pr ...","false","es","","140069","https://t.co/0z8zmgIxRt","true","false","2","false","false","","20","","false","","206","SP/Nordeste, Brasil ","0","","","","[PrayForBrazil]","-1","veicknayara","","false","","2013-01-28T03:39:29.000Z","","[StephaniaSarco]","false"
